date,datetime,headline,source,url,api_source,fetched_for_ticker,relevance_level,relevance_weight,sentiment_score
2019-12-27,2019-12-27T00:00:00,Tesla To Start Delivering Its First China-Made Models On Monday,kaggle,,kaggle,TSLA,SECTOR,0.5,0.21590256690979004
2019-12-27,2019-12-27T00:00:00,"'Citron took A LOT of criticism for change of heart on TSLA. Short interest now at all-time lows. Capitulation has created a ""too much too fast"" stock. Short term risk/reward now skewed to downside. Much respect to Musk but we are buyers 100 pts lower'",kaggle,,kaggle,TSLA,SECTOR,0.5,-0.9444854855537415
2019-12-27,2019-12-27T00:00:00,'Tesla Files New Patent For Advanced Battery Chemistry' -InsideEVs,kaggle,,kaggle,TSLA,SECTOR,0.5,0.3661896288394928
2019-12-27,2019-12-27T00:00:00,Citron Research Says Tesla Shares Are Doing 'Too Much Too Fast',kaggle,,kaggle,TSLA,SECTOR,0.5,-0.9358488321304321
2019-12-27,2019-12-27T00:00:00,"Kenny Glick Says Believes AMD Still Has Not Hit All-Time Highs, Also Still Likes Tesla At Current Levels",kaggle,,kaggle,AMD,SECTOR,0.5,0.842145562171936
2019-12-27,2019-12-27T00:00:00,Tesla Option Alert: Fri $430 Calls Sweep (2) near the Ask: 761 @ $0.625 vs 5543 OI; Earnings 1/29 After Close [est] Ref=$430.015,kaggle,,kaggle,TSLA,SECTOR,0.5,-0.07889613509178162
2019-12-28,2019-12-28T00:00:00,"Bulls And Bears Of The Week: Amazon, Apple, Boeing, Netflix, Tesla And More",kaggle,,kaggle,TSLA,DIRECT,1.0,0.0055505018681287766
2019-12-30,2019-12-30T00:00:00,"'Tesla Model 3 Deliveries In The Netherlands Exceed 11,000 This Month' -Inside EVs",kaggle,,kaggle,TSLA,SECTOR,0.5,0.0675356537103653
2019-12-30,2019-12-30T00:00:00,Advanced Micro Devices shares are trading lower. Not seeing any news to justify the price action.,kaggle,,kaggle,AMD,SECTOR,0.5,-0.9252313375473022
2019-12-30,2019-12-30T00:00:00,"WSJ Investigation Finds China's Corporate Espionage Larger Than Previously Known; Chinese Hackers Used Cloud Service Providers Including CGI And IBM, IBM Says 'We Have No Evidence That Any Sensitive Corporate Data Was Compromised'",kaggle,,kaggle,IBM,SECTOR,0.5,-0.890652060508728
2019-12-30,2019-12-30T00:00:00,Tesla Begins Delivery Of First China-Made Model,kaggle,,kaggle,TSLA,SECTOR,0.5,0.3748501241207123
2019-12-30,2019-12-30T00:00:00,Here's How Much Investing $100 In Nvidia Stock Back In 2010 Would Be Worth Today,kaggle,,kaggle,NVDA,SECTOR,0.5,0.02920255810022354
2019-12-30,2019-12-30T00:00:00,'Tesla delays some US deliveries to next year in end-of-year rush ' -Electrek,kaggle,,kaggle,TSLA,SECTOR,0.5,-0.9326168298721313
2019-12-30,2019-12-30T00:00:00,Tesla Delivers 15 China Made Model 3 Vehicles From Its Shanghai Plant; Tesla Senior China Official Xue Juncheng Says Firm Will Build Dozens of New Tesla Centers in China Next Year,kaggle,,kaggle,TSLA,SECTOR,0.5,0.7524072527885437
2019-12-30,2019-12-30T00:00:00,'Tesla batteries help power new solar water desalination plant in Africa' -Electrek,kaggle,,kaggle,TSLA,SECTOR,0.5,0.26770010590553284
2019-12-30,2019-12-30T00:00:00,"Tesla shares are trading lower after Cowen & Co maintained an underperform rating despite raising the price target from $190 to $210. The firm noted 'We believe Tesla will deliver ~356k vehicles for the year, just slightly missing the low end of the 360-400k delivery guide for the year.'",kaggle,,kaggle,TSLA,SECTOR,0.5,-0.9593707323074341
2019-12-30,2019-12-30T00:00:00,Inside EVs Video Shows Tesla Gigafactory 3 Parking Lot Is 'Almost Complete',kaggle,,kaggle,TSLA,SECTOR,0.5,0.810137152671814
2019-12-30,2019-12-30T00:00:00,"Wedbush Projects Apple To Dominate 5G 'Super Cycle,' Disney To Beat Netflix",kaggle,,kaggle,TSLA,DIRECT,1.0,0.5729913711547852
2019-12-30,2019-12-30T00:00:00,"UPDATE: Cowen On Tesla Notes 'Despite commentary earlier this year suggesting a smoothing of deliveries throughout the quarter, Tesla appears to continue to stress its logistics for end of quarter surges'",kaggle,,kaggle,TSLA,SECTOR,0.5,0.8489745855331421
2019-12-30,2019-12-30T00:00:00,YouTube To Limit Data It Collects On Kids Videos,kaggle,,kaggle,GOOGL,SECTOR,0.5,-0.547640323638916
2019-12-30,2019-12-30T00:00:00,"Cowen Still Bearish On Tesla, Says Chinese And Dutch Help Isn't Enough",kaggle,,kaggle,TSLA,SECTOR,0.5,-0.8067612051963806
2019-12-30,2019-12-30T00:00:00,Amazon Pays 13 Times More In Taxes With Hopes To Expand Business In Japan,kaggle,,kaggle,GOOGL,SECTOR,0.5,0.8180668950080872
2019-12-30,2019-12-30T00:00:00,Tesla China General Manager Wang Hao Says Sales of China-made Model 3 Have Been Very Good,kaggle,,kaggle,TSLA,SECTOR,0.5,0.9352831244468689
2019-12-30,2019-12-30T00:00:00,"Cowen & Co. Maintains Underperform on Tesla, Raises Price Target to $210",kaggle,,kaggle,TSLA,SECTOR,0.5,0.6358774900436401
2019-12-30,2019-12-30T00:00:00,"UPDATE: Cowen Maintains Underperform On Tesla, Raises Target To $210 Notes 'We believe Tesla will deliver ~356k vehicles for the year, just slightly missing the low end of the 360-400k delivery guide for the year'",kaggle,,kaggle,TSLA,SECTOR,0.5,0.6640815734863281
2019-12-30,2019-12-30T00:00:00,UPDATE: Cowen On Tesla Notes 'We are raising our 4Q19 delivery estimate from 95k to 101k to reflect better expectations for both the Netherlands and China ahead of anticipated subsidy reductions in 2020',kaggle,,kaggle,TSLA,SECTOR,0.5,0.9246304035186768
2019-12-31,2019-12-31T00:00:00,'Car And Driver's Long-Term Tesla Model Had 3-Way Failure While Parked' -InsideEVs,kaggle,,kaggle,TSLA,SECTOR,0.5,-0.7858877182006836
2019-12-31,2019-12-31T00:00:00,Intel Vs. AMD: Reviewing The Rivalry As CPU Market Shares Shift,kaggle,,kaggle,AMD,SECTOR,0.5,0.07536211609840393
2019-12-31,2019-12-31T00:00:00,"Google Will Scrap Dutch, Irish IP Licensing System, Will Return IP To US",kaggle,,kaggle,GOOGL,SECTOR,0.5,0.04488678276538849
2019-12-31,2019-12-31T00:00:00,"Uber May Need to Curtail or Shut Down its Food Ordering Business in 2020 Due to Competition from Google, Others Says Analyst",kaggle,,kaggle,GOOGL,SECTOR,0.5,-0.9456626176834106
2019-12-31,2019-12-31T00:00:00,"Benzinga Pro's Top 5 Stocks To Watch For Tues., Dec. 31, 2019: AMZN, WBAI, NVCN, NIO, NVDA",kaggle,,kaggle,NVDA,SECTOR,0.5,0.03363373875617981
2019-12-31,2019-12-31T00:00:00,"Benchmark Maintains Buy on NVIDIA, Raises Price Target to $275",kaggle,,kaggle,NVDA,SECTOR,0.5,0.6528558135032654
2020-01-02,2020-01-02T00:00:00,"Nomura Instinet Maintains Buy on Advanced Micro Devices, Raises Price Target to $58",kaggle,,kaggle,AMD,SECTOR,0.5,0.8482581377029419
2020-01-02,2020-01-02T00:00:00,2020 Vision: Rally Mode To Start Off Decade As Last Year's Strength Rolls Along,kaggle,,kaggle,AMD,MARKET,0.2,0.7858983874320984
2020-01-02,2020-01-02T00:00:00,"UPDATE: Nomura Instinet Maintains Buy On Advanced Micro Devices, Raises Target To $58 As Firm Expects Co. 'to continue strengthening its competitive position in 2020 through a steady stream of new product introductions on 7nm and 7nm+ technologies'",kaggle,,kaggle,AMD,SECTOR,0.5,0.9349012970924377
2020-01-02,2020-01-02T00:00:00,Here's How Much Investing $100 In IBM Stock Back In 2010 Would Be Worth Today,kaggle,,kaggle,IBM,SECTOR,0.5,0.03432633727788925
2020-01-02,2020-01-02T00:00:00,Advanced Micro Devices shares are trading higher after Nomura Instinet maintained a Buy rating on the stock and raised the price target from $40 to $58.,kaggle,,kaggle,AMD,SECTOR,0.5,0.9266149997711182
2020-01-02,2020-01-02T00:00:00,Tesla shares are trading higher after the company said it would deliver a second batch of China-made Model 3S on January 7th.,kaggle,,kaggle,TSLA,SECTOR,0.5,0.9294047951698303
2020-01-02,2020-01-02T00:00:00,"Tesla Cuts Price for China-made Model 3 Vehicles to 299,050 Yuan",kaggle,,kaggle,TSLA,SECTOR,0.5,0.001925140619277954
2020-01-02,2020-01-02T00:00:00,"Nomura Internet Stock Preview For The Year: Buy Google, Activision Blizzard",kaggle,,kaggle,GOOGL,SECTOR,0.5,0.03653498366475105
2020-01-02,2020-01-02T00:00:00,Google Says Its AI Sometimes Outperforms Human Doctors In Detecting Cancer,kaggle,,kaggle,GOOGL,SECTOR,0.5,0.7831253409385681
2020-01-02,2020-01-02T00:00:00,Today's Pickup: Asia's Richest Man Looks To Stand Up To Amazon's Might In India,kaggle,,kaggle,TSLA,SECTOR,0.5,0.9046295881271362
2020-01-02,2020-01-02T00:00:00,Canaccord Lifts Tesla Price Target Above $500 Amid International Opportunity,kaggle,,kaggle,TSLA,SECTOR,0.5,0.7417575120925903
2020-01-02,2020-01-02T00:00:00,"UPDATE: Canaccord Genuity Maintains Buy On Tesla, Raises Target To $515 As Firm Believes 'the trend towards electrification will only accelerate in 2020'; Anticipates Co's Q4 Delivery Numbers Will Be Above Co's 360,000 Unit Guidance For 2019",kaggle,,kaggle,TSLA,SECTOR,0.5,0.9213711619377136
2020-01-02,2020-01-02T00:00:00,Tesla To Begin Delivering China-Made Model 3 To Public On Jan. 7,kaggle,,kaggle,TSLA,SECTOR,0.5,0.12785585224628448
2020-01-02,2020-01-02T00:00:00,"Canaccord Genuity Maintains Buy on Tesla, Raises Price Target to $515",kaggle,,kaggle,TSLA,SECTOR,0.5,0.6963288187980652
2020-01-02,2020-01-02T00:00:00,Hearing Canaccord Genuity Raised Tesla Price Target From $375 To $515; Unconfirmed,kaggle,,kaggle,TSLA,SECTOR,0.5,0.42556774616241455
2020-01-02,2020-01-02T00:00:00,Tesla Says will Deliver Second Batch of China-made Model 3s on January 7,kaggle,,kaggle,TSLA,SECTOR,0.5,0.5506927967071533
2020-01-02,2020-01-02T00:00:00,"Wedbush Says Tesla Poised For Q4 Delivery Upside On Model 3 Demand, European Strength",kaggle,,kaggle,TSLA,SECTOR,0.5,0.580168604850769
2020-01-03,2020-01-03T00:00:00,"UPDATE: Tesla Says 'Our delivery count should be viewed as slightly conservative, as we only count a car as delivered if it is transferred to the customer and all paperwork is correct'",kaggle,,kaggle,TSLA,SECTOR,0.5,0.05768992006778717
2020-01-03,2020-01-03T00:00:00,Tesla Reports Record Q4 Deliveries,kaggle,,kaggle,TSLA,SECTOR,0.5,0.35502398014068604
2020-01-03,2020-01-03T00:00:00,"Benzinga Pro's Top 5 Stocks To Watch For Fri., Jan. 3, 2020: TSLA, AAPL, YUMA, AXE, CMG",kaggle,,kaggle,TSLA,DIRECT,1.0,0.02856423333287239
2020-01-03,2020-01-03T00:00:00,"Tesla Reports Q4 Model S/X Production ~17.9K Vehicles, Model 3 Production ~86.96K Vehicles",kaggle,,kaggle,TSLA,SECTOR,0.5,0.08234447240829468
2020-01-03,2020-01-03T00:00:00,"Tesla Reports FY19 Deliveries ~367.6K, Up 50% Year Over Year",kaggle,,kaggle,TSLA,SECTOR,0.5,0.9325396418571472
2020-01-03,2020-01-03T00:00:00,"China-made Exports of Ford, Tesla, BBMW Set to Surge as Beijing Opens Auto Industry, Government Says",kaggle,,kaggle,TSLA,SECTOR,0.5,0.9141361713409424
2020-01-03,2020-01-03T00:00:00,"Tesla Cuts Price of Made-in-China Model 3 to ~$43,000 after Incentives",kaggle,,kaggle,TSLA,SECTOR,0.5,-0.20682711899280548
2020-01-03,2020-01-03T00:00:00,Chinese EV Maker Lixiang Files for Minimum $500M U.S. IPO,kaggle,,kaggle,TSLA,MARKET,0.2,0.13647529482841492
2020-01-03,2020-01-03T00:00:00,"Canaccord Maintains Buy, $515 Target On Tesla As Firm Notes 'we view these results as a clear indication that EV demand remains strong for Tesla and that the company is well positioned for 2020 with continued positive momentum in all business areas'",kaggle,,kaggle,TSLA,SECTOR,0.5,0.936701238155365
2020-01-03,2020-01-03T00:00:00,"Tesla Q4 Production Almost 105K Vehicles, Deliveries ~112K Vehicles",kaggle,,kaggle,TSLA,SECTOR,0.5,0.05617501214146614
2020-01-03,2020-01-03T00:00:00,Tesla Shorts Are Still Holding On (For Now),kaggle,,kaggle,TSLA,SECTOR,0.5,0.4603610038757324
2020-01-03,2020-01-03T00:00:00,"Tesla shares are trading higher after the company reported record deliveries of roughly 367,600 in FY19, which is a 50% year-over-year increase.",kaggle,,kaggle,TSLA,SECTOR,0.5,0.9355866312980652
2020-01-03,2020-01-03T00:00:00,Amazon To Employee Climate Activists: Toe The Line Or Get Fired,kaggle,,kaggle,GOOGL,SECTOR,0.5,-0.2371402531862259
2020-01-03,2020-01-03T00:00:00,'@Xiaomi said Friday it had fixed a bug and communicated with @Google n response to the US firm disabling #Xiaomi link to Assistant and Google Home after a user reported seeing footage from other cameras.' -China's Global Times,kaggle,,kaggle,GOOGL,SECTOR,0.5,-0.8503819704055786
2020-01-04,2020-01-04T00:00:00,"Benzinga's Bulls And Bears Of The Week: Apple, Disney, Starbucks, Tiffany And More",kaggle,,kaggle,TSLA,DIRECT,1.0,0.0005077626556158066
2020-01-04,2020-01-04T00:00:00,"Tesla Model 3 Production In China Already Above 3,000 Per Week",kaggle,,kaggle,TSLA,SECTOR,0.5,0.8217076659202576
2020-01-04,2020-01-04T00:00:00,What To Expect From AMD At CES 2020,kaggle,,kaggle,AMD,SECTOR,0.5,0.009669344872236252
2020-01-05,2020-01-05T00:00:00,"Barron's Picks And Pans: Amazon, Dine Brands, Walgreens And More",kaggle,,kaggle,GOOGL,SECTOR,0.5,0.0029765628278255463
2020-01-06,2020-01-06T00:00:00,Pros Discuss Apple Stock One Year After Profit Scare,kaggle,,kaggle,CSCO,DIRECT,1.0,0.013665266335010529
2020-01-06,2020-01-06T00:00:00,Salesforce.Com shares are trading higher after RBC Capital upgraded the stock from Outperform to Top Pick and raised the price target from $200 to $215 per share.,kaggle,,kaggle,CRM,SECTOR,0.5,0.9277647733688354
2020-01-06,2020-01-06T00:00:00,"RBC Capital Upgrades Salesforce.com to Top Pick, Raises Price Target to $215",kaggle,,kaggle,CRM,SECTOR,0.5,0.9088042974472046
2020-01-06,2020-01-06T00:00:00,Tesla CEO Elon Musk Plans to Attend a Delivery Ceremony for Made-in-China Teslas in Shanghai on Tuesday,kaggle,,kaggle,TSLA,SECTOR,0.5,0.05941975861787796
2020-01-06,2020-01-06T00:00:00,AMD Unveils Four New Desktop And Mobile GPUs,kaggle,,kaggle,AMD,SECTOR,0.5,0.26239657402038574
2020-01-06,2020-01-06T00:00:00,Advanced Micro Devices Option Alert: Feb 21 $45 Calls Sweep (33) near the Ask: 1500 @ $5.651 vs 9332 OI; Earnings 1/28 After Close [est] Ref=$48.245,kaggle,,kaggle,AMD,SECTOR,0.5,0.10654601454734802
2020-01-06,2020-01-06T00:00:00,"'Tesla Model 3 to be $5,000 cheaper in New Jersey; Turnpike getting electrified' -Electrek",kaggle,,kaggle,TSLA,SECTOR,0.5,0.39052751660346985
2020-01-06,2020-01-06T00:00:00,'Tesla plans to build 'future vehicles' at Gigafactory 4 as new details emerge' -Electrek,kaggle,,kaggle,TSLA,SECTOR,0.5,0.1827215701341629
2020-01-06,2020-01-06T00:00:00,"Tesla Option Alert: Jan, 2021 $200 Puts at the Bid: 1000 @ $7.25 vs 10524 OI; Earnings 1/29 After Close [est] Ref=$445.46",kaggle,,kaggle,TSLA,SECTOR,0.5,0.022113077342510223
2020-01-06,2020-01-06T00:00:00,"RBC Capital Maintains Underperform on Tesla, Raises Price Target to $315",kaggle,,kaggle,TSLA,SECTOR,0.5,0.7073274850845337
2020-01-06,2020-01-06T00:00:00,Alphabet shares are trading higher after Pivotal Researched upgraded the stock from Hold to Buy and raised the price target from $1.445k to $1.65k per share.,kaggle,,kaggle,GOOGL,SECTOR,0.5,0.9298608899116516
2020-01-07,2020-01-07T00:00:00,'Sonos sues Google for allegedly swiping speaker tech' -Washington Post,kaggle,,kaggle,GOOGL,SECTOR,0.5,-0.7360870242118835
2020-01-07,2020-01-07T00:00:00,"Sony, Nvidia, Uber Introduce Electric, Autonomous Auto Concepts At CES",kaggle,,kaggle,NVDA,SECTOR,0.5,0.1358739286661148
2020-01-07,2020-01-07T00:00:00,"Morgan Stanley On AMD At CES: 'Impressive Group Of Products, But Nothing Particularly Surprising'",kaggle,,kaggle,AMD,SECTOR,0.5,0.8638167381286621
2020-01-07,2020-01-07T00:00:00,"Wells Fargo Maintains Overweight on Advanced Micro Devices, Raises Price Target to $55",kaggle,,kaggle,AMD,SECTOR,0.5,0.9133532643318176
2020-01-07,2020-01-07T00:00:00,Argus Raises Price Target On Tesla From $396 To $556,kaggle,,kaggle,TSLA,SECTOR,0.5,0.19513055682182312
2020-01-07,2020-01-07T00:00:00,"Benzinga Pro's Top 5 Stocks To Watch For Tues., Jan. 7, 2020: TSLA, SQ, LEN, APOP, PIR",kaggle,,kaggle,TSLA,SECTOR,0.5,0.025698043406009674
2020-01-07,2020-01-07T00:00:00,Elon Musk Busts A Move As First Chinese-Made Model 3s Delivered,kaggle,,kaggle,TSLA,SECTOR,0.5,0.425593763589859
2020-01-07,2020-01-07T00:00:00,3 Tesla Pros On The Automaker's China Milestone,kaggle,,kaggle,TSLA,SECTOR,0.5,0.5463404655456543
2020-01-08,2020-01-08T00:00:00,Elon Musk Tweets: 'Tesla China Team Such amazing progress!!',kaggle,,kaggle,TSLA,SECTOR,0.5,0.8701797723770142
2020-01-08,2020-01-08T00:00:00,"Tesla shares are trading higher, potentially amid continued optimism surrounding the company's China production. CEO Elon Musk on Twitter suggested the company was making 'amazing progress' in China, sending shares higher.",kaggle,,kaggle,TSLA,SECTOR,0.5,0.9291612505912781
2020-01-08,2020-01-08T00:00:00,"Tesla, Musk Approach Historic Milestones As Automaker's Stock Rally Continues",kaggle,,kaggle,TSLA,SECTOR,0.5,0.887860894203186
2020-01-08,2020-01-08T00:00:00,Bank of America Downgrades Cisco Systems to Neutral,kaggle,,kaggle,CSCO,SECTOR,0.5,-0.8138898015022278
2020-01-08,2020-01-08T00:00:00,Cramer Questions Why Tesla's Stock Isn't Higher,kaggle,,kaggle,TSLA,SECTOR,0.5,-0.014547023922204971
2020-01-08,2020-01-08T00:00:00,"Oracle Option Alert: Jan, 2021 $80 Calls Sweep (20) near the Ask: 1783 @ $0.15 vs 129 OI; Ref=$54.16",kaggle,,kaggle,ORCL,SECTOR,0.5,-0.007328897714614868
2020-01-08,2020-01-08T00:00:00,"Oracle Option Alert: Jan, 2021 $80 Calls Sweep (44) near the Ask: 2103 @ $0.15 vs 129 OI; Ref=$54.155",kaggle,,kaggle,ORCL,SECTOR,0.5,-0.0386318676173687
2020-01-08,2020-01-08T00:00:00,"'Tesla has to move endangered bats to build Gigafactory 4, could delay and faces opposition' -Electrek",kaggle,,kaggle,TSLA,SECTOR,0.5,-0.8159689903259277
2020-01-08,2020-01-08T00:00:00,"Delta Air Lines To Explore Partnership With IBM, Including Joining IBM Q Network",kaggle,,kaggle,IBM,SECTOR,0.5,0.7043291330337524
2020-01-08,2020-01-08T00:00:00,Electrek Reports Daimler/BMW Ride-Hailing Service Is Ordering 60 Tesla Vehicles,kaggle,,kaggle,TSLA,SECTOR,0.5,0.15994562208652496
2020-01-08,2020-01-08T00:00:00,AMD Announces New CPUs and GPUs at CES 2020,kaggle,,kaggle,AMD,SECTOR,0.5,0.21383199095726013
2020-01-09,2020-01-09T00:00:00,Hearing CFRA Downgrades Tesla From Hold To Sell; Unconfirmed,kaggle,,kaggle,TSLA,SECTOR,0.5,-0.6140168309211731
2020-01-09,2020-01-09T00:00:00,"Baird Downgrades Tesla to Neutral, Raises Price Target to $525",kaggle,,kaggle,TSLA,SECTOR,0.5,0.6109004616737366
2020-01-09,2020-01-09T00:00:00,Advanced Micro Devices shares are trading higher after Mizuho upgraded the stock from Neutral to Buy and raised the price target from $38 to $55 per share.,kaggle,,kaggle,AMD,SECTOR,0.5,0.9293212890625
2020-01-09,2020-01-09T00:00:00,"Mizuho Upgrades Advanced Micro Devices to Buy, Raises Price Target to $55",kaggle,,kaggle,AMD,SECTOR,0.5,0.8957904577255249
2020-01-09,2020-01-09T00:00:00,"UPDATE: Baird On Tesla Notes 'Shares now fairly reflect future execution, in our view, including a smooth Model Y ramp; while this is certainly achievable, we believe there is some risk (as with any product launch)'",kaggle,,kaggle,TSLA,SECTOR,0.5,0.848121702671051
2020-01-09,2020-01-09T00:00:00,"UPDATE: Baird Downgrades Tesla To Neutral, Raises Target To $525 Notes 'We are moving to the sidelines, admittedly battle-weary after a hard-fought several years, including ~20% outperformance over the last year'",kaggle,,kaggle,TSLA,SECTOR,0.5,0.8337438702583313
2020-01-09,2020-01-09T00:00:00,"PreMarket Prep Recap: Tesla Shrugs Off Double Downgrade, Bed Bath & Beyond Continues Fall",kaggle,,kaggle,TSLA,SECTOR,0.5,0.35900449752807617
2020-01-09,2020-01-09T00:00:00,"Back To The Grind: Iran Fears Ease, So Focus Turns To Jobs, Fed Speakers, Earnings",kaggle,,kaggle,TSLA,MARKET,0.2,0.058916278183460236
2020-01-09,2020-01-09T00:00:00,"Tesla shares are trading lower after analysts at Baird downgraded the stock from Outperform to Neutral, recommending investors take profits . CFRA also downgraded the stock from Hold to Sell, citing near-term risks.",kaggle,,kaggle,TSLA,SECTOR,0.5,-0.964775562286377
2020-01-09,2020-01-09T00:00:00,"Bernstein Initiates Coverage On Facebook And Google With Outperform Ratings; Firm Also Initiates Coverage On Amazon At Market Perform, Citing Exposure To Retail And Regulatory Concerns",kaggle,,kaggle,GOOGL,SECTOR,0.5,-0.18572819232940674
2020-01-09,2020-01-09T00:00:00,"CFRA Research Downgrades Tesla, Sees Risks Ahead After Huge Run",kaggle,,kaggle,TSLA,SECTOR,0.5,-0.5208988785743713
2020-01-09,2020-01-09T00:00:00,Google's Travel Site Updated To Provide More Info,kaggle,,kaggle,GOOGL,SECTOR,0.5,0.025805702432990074
2020-01-09,2020-01-09T00:00:00,CORRECTION: Baird Downgrades Tesla to Neutral from Outperform; Raises Price Target to $525 from $355,kaggle,,kaggle,TSLA,SECTOR,0.5,0.8930319547653198
2020-01-09,2020-01-09T00:00:00,Should Nio Be Worried About Tesla's Model 3 Order Overflows In China?,kaggle,,kaggle,TSLA,SECTOR,0.5,-0.836622953414917
2020-01-09,2020-01-09T00:00:00,"CFRA Downgrades Tesla to Sell, Announces $400 Price Target",kaggle,,kaggle,TSLA,SECTOR,0.5,-0.6355506777763367
2020-01-09,2020-01-09T00:00:00,Is Elon Musk's Girlfriend Grimes Pregnant?,kaggle,,kaggle,TSLA,SECTOR,0.5,-0.22126887738704681
2020-01-10,2020-01-10T00:00:00,"Bernstein Initiates Coverage On Alphabet with Outperform Rating, Announces $1.6K Price Target",kaggle,,kaggle,GOOGL,SECTOR,0.5,0.42715349793434143
2020-01-10,2020-01-10T00:00:00,"Spotify, YouTube, Other Streaming Platforms Exceed Trillion In 2019",kaggle,,kaggle,GOOGL,SECTOR,0.5,0.09077654033899307
2020-01-10,2020-01-10T00:00:00,Facebook Refuses To Limit Political Ads But Gives Users More Control Over Them,kaggle,,kaggle,GOOGL,SECTOR,0.5,0.0027417391538619995
2020-01-10,2020-01-10T00:00:00,"Jefferies Maintains Buy on Adobe, Raises Price Target to $390",kaggle,,kaggle,ADBE,SECTOR,0.5,0.4823939800262451
2020-01-10,2020-01-10T00:00:00,"B of A Securities Reiterates Buy on Adobe, Raises Price Target to $400",kaggle,,kaggle,ADBE,SECTOR,0.5,0.2147415578365326
2020-01-10,2020-01-10T00:00:00,"Weaker Than Expected December Jobs Report Might Weigh, But Overall Growth Positive",kaggle,,kaggle,AMD,MARKET,0.2,-0.44410932064056396
2020-01-10,2020-01-10T00:00:00,"BofA Names Nvidia, Inphi Its Top Semiconductor Stock Picks For 2020",kaggle,,kaggle,AMD,SECTOR,0.5,0.1519264578819275
2020-01-10,2020-01-10T00:00:00,Nvidia Added To Citi's Catalyst Watch; Expects Outperformance,kaggle,,kaggle,NVDA,SECTOR,0.5,0.8178859949111938
2020-01-10,2020-01-10T00:00:00,"B of A Securities Reiterates Buy on NVIDIA, Raises Price Target to $300",kaggle,,kaggle,NVDA,SECTOR,0.5,0.4489968717098236
2020-01-10,2020-01-10T00:00:00,"Piper Sandler Maintains Overweight on Tesla, Raises Price Target to $553",kaggle,,kaggle,TSLA,SECTOR,0.5,0.8440647721290588
2020-01-10,2020-01-10T00:00:00,"UPDATE: B Of A Securities On Nvidia Notes 'In our 2020 playbook, we flag NVDA as our top large cap pick... due to its leading growth (15%+ sales/20%+ EPS CAGR, CY19-21E) at a still reasonable valuation (30x CY21 PE, 2-turns below 3-yr avg.)",kaggle,,kaggle,NVDA,SECTOR,0.5,0.9329415559768677
2020-01-10,2020-01-10T00:00:00,Here's How Much Investing $100 In Tesla Stock Back In 2010 Would Be Worth Today,kaggle,,kaggle,TSLA,SECTOR,0.5,0.034518446773290634
2020-01-10,2020-01-10T00:00:00,"Salesforce Data Shows 8% Increase In Digital Spend Over 2019 Holiday Season, With $723B In Digital Sales Worldwide",kaggle,,kaggle,CRM,SECTOR,0.5,0.9314562082290649
2020-01-12,2020-01-12T00:00:00,"Tesla Will Soon 'Talk To People,' Musk Hints New Feature",kaggle,,kaggle,TSLA,SECTOR,0.5,0.08729996532201767
2020-01-12,2020-01-12T00:00:00,"Bulls And Bears Of The Week: Apple, Citigroup, Southwest, Walgreens And More",kaggle,,kaggle,TSLA,DIRECT,1.0,0.006920117884874344
2020-01-13,2020-01-13T00:00:00,"Evercore ISI Group Downgrades IBM to In-Line, Announces $145 Price Target",kaggle,,kaggle,IBM,SECTOR,0.5,-0.793623149394989
2020-01-13,2020-01-13T00:00:00,'Tesla numbers will go up because of China subsidy extension. Analysts need to raise numbers.. $TSLA' -CNBC's Jim Cramer,kaggle,,kaggle,TSLA,SECTOR,0.5,0.834439218044281
2020-01-13,2020-01-13T00:00:00,Hearing Oppenheimer Raised its Price Target on Tesla from $385 to $612,kaggle,,kaggle,TSLA,SECTOR,0.5,0.8422261476516724
2020-01-13,2020-01-13T00:00:00,'Elon Musk: Tesla's Full Self-Driving 'feature-complete' is coming 'soon'' -Electrek,kaggle,,kaggle,TSLA,SECTOR,0.5,0.17474661767482758
2020-01-13,2020-01-13T00:00:00,Tesla $93B Valuation: Does A Great Product Equate To A Great Stock?,kaggle,,kaggle,TSLA,SECTOR,0.5,0.08858945220708847
2020-01-13,2020-01-13T00:00:00,"Oppenheimer, In Earlier Price Target Raise, Says Tesla Is 'beginning to pose an existential threat to transportation companies that are unable or unwilling to innovate at a faster pace.'",kaggle,,kaggle,TSLA,SECTOR,0.5,-0.9405962228775024
2020-01-13,2020-01-13T00:00:00,"Tesla Gets New Street-High Price Target, Stock Breaks $500",kaggle,,kaggle,TSLA,SECTOR,0.5,0.3847823739051819
2020-01-13,2020-01-13T00:00:00,"Oppenheimer Maintains Outperform on Tesla, Raises Price Target to $612",kaggle,,kaggle,TSLA,SECTOR,0.5,0.8254001140594482
2020-01-13,2020-01-13T00:00:00,Tesla shares are trading higher after multiple firms raised the price target on the stock.,kaggle,,kaggle,TSLA,SECTOR,0.5,0.9270327091217041
2020-01-13,2020-01-13T00:00:00,"Credit Suisse Maintains Outperform on Salesforce.com, Raises Price Target to $215",kaggle,,kaggle,CRM,SECTOR,0.5,0.8367016911506653
2020-01-13,2020-01-13T00:00:00,"Evercore ISI Group Maintains Outperform on Alphabet, Raises Price Target to $1.6K",kaggle,,kaggle,GOOGL,SECTOR,0.5,0.8620297312736511
2020-01-13,2020-01-13T00:00:00,NVIDIA shares are trading higher after Needham upgraded the company's stock from Underperform to Hold.,kaggle,,kaggle,NVDA,SECTOR,0.5,0.9303972721099854
2020-01-13,2020-01-13T00:00:00,Analysts Upbeat After Nvidia's CES Presentations: 'Must-Own Stock For Technology Investors',kaggle,,kaggle,NVDA,SECTOR,0.5,0.6927902698516846
2020-01-13,2020-01-13T00:00:00,"Craig-Hallum Earlier Reiterated Buy on NVIDIA, Raised Price Target to $300",kaggle,,kaggle,NVDA,SECTOR,0.5,0.8938987851142883
