date,datetime,headline,source,url,api_source,fetched_for_ticker,relevance_level,relevance_weight,sentiment_score
2019-08-27,2019-08-27T00:00:00,Department Of Justice Files Criminal Charges Against Anthony Levandowski Alleging Theft Of Alphabet Trade Secrets; Justice Department Says Levandowski Stole Engineering Details For Lidar Technology Before Eventually Working At Uber,kaggle,,kaggle,GOOGL,SECTOR,0.5,-0.670179545879364
2019-08-27,2019-08-27T00:00:00,"Chubb, Salesforce And More 'Fast Money' Picks For August 27",kaggle,,kaggle,CRM,SECTOR,0.5,0.021645573899149895
2019-08-28,2019-08-28T00:00:00,Shares of several software companies are trading lower with sympathy to Autodesk after the company issued Q3 and FY20 guidance below analyst estimates.,kaggle,,kaggle,CRM,SECTOR,0.5,-0.9654058218002319
2019-08-28,2019-08-28T00:00:00,Cisco Reports Exploit Of Vulnerability Could Be Used To Bypass Authentication On Cisco Routers Configured With Rest API Support For Cisco IOS XE Software,kaggle,,kaggle,CSCO,SECTOR,0.5,0.1276109516620636
2019-08-28,2019-08-28T00:00:00,"Canaccord Genuity Analyst Richard Davis Comments On Adobe's Weakness In Relation To Potential Sympathy Move On Autodesk's Weak Q3 Forecast, Tell Benzinga 'No, 2 different companies, wildly different segments, products, etc.'",kaggle,,kaggle,ADBE,SECTOR,0.5,-0.8514795899391174
2019-08-28,2019-08-28T00:00:00,Tesla Rolls Out Car Insurance Unit For Drivers of Its Cars In California,kaggle,,kaggle,TSLA,SECTOR,0.5,0.07689695805311203
2019-08-28,2019-08-28T00:00:00,Adobe shares are potentially trading lower after B2B software company Autodesk forecasted worse-than-expected Q3 financial results.,kaggle,,kaggle,ADBE,SECTOR,0.5,-0.9639143943786621
2019-08-28,2019-08-28T00:00:00,"Tesla Launching Tesla Insurance, An Insurance Offering Designed To Provide Tesla Owners With Up To 20% Lower Rates, In Some Cases As Much As 30%",kaggle,,kaggle,TSLA,SECTOR,0.5,0.23555174469947815
2019-08-28,2019-08-28T00:00:00,'Google to move Pixel smartphone production to Vietnam' -Nikkei,kaggle,,kaggle,GOOGL,SECTOR,0.5,0.272688090801239
2019-08-28,2019-08-28T00:00:00,"US Officials Are Seeking To Block An Undersea Cable Backed By Google, Facebook Inc. And A Chinese Partner, WSJ Reports",kaggle,,kaggle,GOOGL,SECTOR,0.5,-0.8561383485794067
2019-08-29,2019-08-29T00:00:00,'Google is facing another EU antitrust probe — this time over its jobs search tool' -CNBC From Yesterday,kaggle,,kaggle,GOOGL,SECTOR,0.5,-0.8690628409385681
2019-08-29,2019-08-29T00:00:00,"Tesla Analyst: Europe Business Steady, 'Demand Challenges Remain'",kaggle,,kaggle,TSLA,SECTOR,0.5,0.7503344416618347
2019-08-29,2019-08-29T00:00:00,"Wedbush Maintains Neutral, $220 Target On Tesla As Firm Notes 'While there have been some delivery speed bumps/service snafus in the European delivery process, it appears the timing of deliveries and ramping demand is roughly on track in the region'",kaggle,,kaggle,TSLA,SECTOR,0.5,0.6392993927001953
2019-08-29,2019-08-29T00:00:00,Shares of several semiconductor companies are trading higher after China's Ministry of Commerce said the country is willing to work to resolve US trade tensions and does not want any further escalation.,kaggle,,kaggle,NVDA,SECTOR,0.5,0.8626689314842224
2019-08-30,2019-08-30T00:00:00,"Bargersville, Indiana, Police Department Switching to Tesla Model 3 vs Dodge Charger",kaggle,,kaggle,TSLA,SECTOR,0.5,0.06694526970386505
2019-08-30,2019-08-30T00:00:00,Tesla To Be Exempt From China auto Purchase Tax,kaggle,,kaggle,TSLA,SECTOR,0.5,0.010913161560893059
2019-08-30,2019-08-30T00:00:00,China Will Exempt 16 Tesla Variants From Purchase Tax,kaggle,,kaggle,TSLA,SECTOR,0.5,0.04474596679210663
2019-08-30,2019-08-30T00:00:00,"Tesla Raises Prices for Model X SUV, Some Model 3 Vehicles in China",kaggle,,kaggle,TSLA,SECTOR,0.5,0.7591468691825867
2019-08-30,2019-08-30T00:00:00,Tesla Raises Prices In China Ahead Of Tariff Increase,kaggle,,kaggle,TSLA,SECTOR,0.5,0.78720623254776
2019-08-30,2019-08-30T00:00:00,"'All $tsla models are waivered sales tax in China, according to gov agency MIIC. This comes today as Tesla is raising price due to Renminbi appreciation. Good for China sales.' -Ming Zhao Of 86 Research",kaggle,,kaggle,TSLA,SECTOR,0.5,0.7830626368522644
2019-08-30,2019-08-30T00:00:00,Tesla shares are trading higher after the company raised prices in China ahead of new tariffs. It was also reported China will exempt 16 Tesla variants from an auto purchase tax.,kaggle,,kaggle,TSLA,SECTOR,0.5,0.8668006658554077
2019-08-30,2019-08-30T00:00:00,'Google to pay up to $200M to settle FTC YouTube investigation' -POLITICO,kaggle,,kaggle,GOOGL,SECTOR,0.5,0.05812013894319534
2019-08-30,2019-08-30T00:00:00,Google To Pay Up To $200M To Settle FTC Youtube Investigation,kaggle,,kaggle,GOOGL,SECTOR,0.5,0.07318970561027527
2019-08-30,2019-08-30T00:00:00,"'Tesla software shows upcoming 'Smart AC Charging' feature, 'Feeling Lucky' update, & games' -Electrek",kaggle,,kaggle,TSLA,SECTOR,0.5,0.11253483593463898
2019-08-30,2019-08-30T00:00:00,AMD Desktop GPU Shipments Overtake Nvidia's For First Time In 5 Years,kaggle,,kaggle,NVDA,SECTOR,0.5,0.9251163005828857
2019-09-03,2019-09-03T00:00:00,"Shares of several semiconductor companies are trading lower as trade concerns continue to escalate following a new 15% tariff, which was added to $112 billion worth of Chinese goods on Sunday.",kaggle,,kaggle,NVDA,SECTOR,0.5,-0.9633420705795288
2019-09-03,2019-09-03T00:00:00,Trader Toolkit: Return Of The MACD,kaggle,,kaggle,NVDA,DIRECT,1.0,0.1037830114364624
2019-09-03,2019-09-03T00:00:00,Tesla Analysts Debate Chinese Tax Exemption: 'Small Victory' Or 'Pretty Big Deal'?,kaggle,,kaggle,TSLA,SECTOR,0.5,0.10791594535112381
2019-09-03,2019-09-03T00:00:00,'Google emerges as target of a new state attorneys general antitrust probe' -Washington Post,kaggle,,kaggle,GOOGL,SECTOR,0.5,-0.2224392592906952
2019-09-03,2019-09-03T00:00:00,Tesla Owners Reportedly Got Locked Out of Their Cars Because the App Was Down,kaggle,,kaggle,TSLA,SECTOR,0.5,-0.8594063520431519
2019-09-04,2019-09-04T00:00:00,"Facebook, Google, Twitter Meeting With US Security Officials At Facebook HQ Wed. To Discuss 2020 US Election",kaggle,,kaggle,GOOGL,SECTOR,0.5,0.028007518500089645
2019-09-04,2019-09-04T00:00:00,Google Fined $170M By FTC Over Accusations Of Child Privacy Violations By YouTube,kaggle,,kaggle,GOOGL,SECTOR,0.5,-0.9142310619354248
2019-09-04,2019-09-04T00:00:00,TD Ameritrade Rolls Out New Hands-Free Google Assistant Integration,kaggle,,kaggle,GOOGL,SECTOR,0.5,0.5457911491394043
2019-09-04,2019-09-04T00:00:00,'F.T.C. Fines Google $170 Million for Violating Children's Privacy on YouTube' NY Times,kaggle,,kaggle,GOOGL,SECTOR,0.5,-0.9177283644676208
2019-09-04,2019-09-04T00:00:00,TD Ameritrade Customers Can Use Google Assistant to Access Accounts,kaggle,,kaggle,GOOGL,SECTOR,0.5,0.031238488852977753
2019-09-04,2019-09-04T00:00:00,'Tech company sources say they've heard the big state AG tech crackdown on @Google and possibly others will be led by AGs in @MississippiAGO @TXAG @UtahAG and Nebraska...' -Tweet From Charlie Gasparino,kaggle,,kaggle,GOOGL,SECTOR,0.5,-0.21495239436626434
2019-09-04,2019-09-04T00:00:00,"Tesla Shares Dip Following Estimated Aug. Model 3, S And X Sales Results; Inside EVs Estimates Co. Delivered 13.15K Model 3 Vehicles, 1,050 Model S Vehicles and 1,825 Model X Vehicles",kaggle,,kaggle,TSLA,SECTOR,0.5,-0.9396640062332153
2019-09-04,2019-09-04T00:00:00,Tesla Providing Clean Energy To Places Around The World That Desperately Need It,kaggle,,kaggle,TSLA,SECTOR,0.5,0.2510526478290558
2019-09-04,2019-09-04T00:00:00,These Are The Leveraged ETFs At Play When Trade War Worries Strike,kaggle,,kaggle,NVDA,MARKET,0.2,0.002331741154193878
2019-09-04,2019-09-04T00:00:00,Shares of many semiconductor companies are trading higher as Hong Kong tensions ease on the withdrawal of the extradition bill that has caused mass protesting. The protests are seen as a potential disruption to the global economy and U.S.-China trade talks.,kaggle,,kaggle,NVDA,SECTOR,0.5,-0.5295610427856445
2019-09-05,2019-09-05T00:00:00,Trefis Research Report Suggests 'Google Could Acquire Nutanix For $9 BillionTo Further Its Cloud Ambitions',kaggle,,kaggle,GOOGL,SECTOR,0.5,0.5652484893798828
2019-09-05,2019-09-05T00:00:00,'Tesla Model 3 Sales Shine In British EV Market In August -Inside EVs,kaggle,,kaggle,TSLA,SECTOR,0.5,0.8984674215316772
2019-09-05,2019-09-05T00:00:00,"'Tesla's insurance program will use direct driver data where it can with permission, exec says' -Electrek",kaggle,,kaggle,TSLA,SECTOR,0.5,0.07630986720323563
2019-09-05,2019-09-05T00:00:00,Shares of several tech companies are trading higher with the broader stock market after the Chinese Minister of Commerce said the leaders of the US and China are set to meet in Washington D.C in October.,kaggle,,kaggle,IBM,MARKET,0.2,0.8989587426185608
2019-09-05,2019-09-05T00:00:00,Shares of many semiconductor companies are trading higher with the broader stock market after the Chinese Minister of Commerce said the U.S. and China are set to meet in Washington D.C in early October.,kaggle,,kaggle,NVDA,SECTOR,0.5,0.903731107711792
2019-09-05,2019-09-05T00:00:00,IHS Says Chip Sales Fell ~14% in H1 2019,kaggle,,kaggle,NVDA,SECTOR,0.5,-0.9678955078125
2019-09-05,2019-09-05T00:00:00,Analyst: Why Google Could Buy Nutanix,kaggle,,kaggle,GOOGL,SECTOR,0.5,0.019254442304372787
2019-09-05,2019-09-05T00:00:00,"GM Will Deploy Google System Over Time, No Lightswitch Change",kaggle,,kaggle,GOOGL,SECTOR,0.5,0.05252736061811447
2019-09-05,2019-09-05T00:00:00,Shares of several large-cap companies are trading higher with the broader stock market after the Chinese Minister of Commerce said the leaders of the U.S. and China are set to meet in Washington D.C in early October.,kaggle,,kaggle,GOOGL,MARKET,0.2,0.892655611038208
2019-09-06,2019-09-06T00:00:00,"New York AG Confirms Antitrust Investigation Into Facebook, Google Is Reportedly Next",kaggle,,kaggle,GOOGL,SECTOR,0.5,0.012349851429462433
2019-09-06,2019-09-06T00:00:00,"Russian Watchdog Says It Has Sent Requests To Google And Facebook Asking For Ban On Political Ads During Upcoming Local Election; Says If Facebook And Google Do Not Comply With Political Ads Ban, Russia Will Consider This Election Interference",kaggle,,kaggle,GOOGL,SECTOR,0.5,-0.8029398322105408
2019-09-06,2019-09-06T00:00:00,"Telenav Says GM Contact Unaffected By Deal Between Automaker, Google",kaggle,,kaggle,GOOGL,SECTOR,0.5,-0.6820728182792664
2019-09-06,2019-09-06T00:00:00,"States Launching Google, Facebook Antitrust Probes; Google Probe to Be Announced Monday",kaggle,,kaggle,GOOGL,SECTOR,0.5,-0.14050734043121338
2019-09-06,2019-09-06T00:00:00,Texas Attorney General To Announce Launch Of Multistate Investigation Into Whether Big Tech Companies Broke Antitrust Law On Monday,kaggle,,kaggle,GOOGL,SECTOR,0.5,-0.08570238947868347
2019-09-06,2019-09-06T00:00:00,"'States to Launch Google, Facebook Antitrust Probes' -WSJ",kaggle,,kaggle,GOOGL,SECTOR,0.5,-0.0002455785870552063
2019-09-06,2019-09-06T00:00:00,Safety Group Calls For Tesla Recall After NTSB Report,kaggle,,kaggle,TSLA,SECTOR,0.5,-0.8092725276947021
2019-09-06,2019-09-06T00:00:00,Google Parent Alphabet Received Civil Investigative Demand from DoJ on Aug. 30; Seeks Information and Documents Related to Prior Antitrust Investigations in U.S. and Elsewhere,kaggle,,kaggle,GOOGL,SECTOR,0.5,0.002214450389146805
2019-09-06,2019-09-06T00:00:00,'Google files patent for using A.I. to track a baby's body and eye movements ' -CNBC,kaggle,,kaggle,GOOGL,SECTOR,0.5,0.08750539273023605
2019-09-07,2019-09-07T00:00:00,Tesla Eliminates Fee to Remove Solar Rental Products,kaggle,,kaggle,TSLA,SECTOR,0.5,0.02036258950829506
2019-09-07,2019-09-07T00:00:00,Elon Musk Tweets in Response to Question Regarding Launch Date for Pickup Truck: 'November most likely',kaggle,,kaggle,TSLA,SECTOR,0.5,0.08267663419246674
2019-09-07,2019-09-07T00:00:00,Facebook Dating Vs. Match.com Vs. Tinder,kaggle,,kaggle,GOOGL,SECTOR,0.5,-0.002065502107143402
2019-09-09,2019-09-09T00:00:00,This ARK ETF Is Flipping Its Script,kaggle,,kaggle,TSLA,MARKET,0.2,0.006359204649925232
2019-09-09,2019-09-09T00:00:00,Tesla Officially Launches in Iceland,kaggle,,kaggle,TSLA,SECTOR,0.5,0.08832778036594391
2019-09-09,2019-09-09T00:00:00,"Google Says It Supports Responsible Political Ads That Comply With Local Legislation, Following Russian Accusation It Distributed Political Advertising During Sunday Elections",kaggle,,kaggle,GOOGL,SECTOR,0.5,-0.08262422680854797
2019-09-09,2019-09-09T00:00:00,Oracle shares trading higher on no company-specific news. Oracle will report Q1 earnings after the market closes on Thursday.,kaggle,,kaggle,ORCL,SECTOR,0.5,0.8249262571334839
2019-09-09,2019-09-09T00:00:00,"'.@Huawei confirmed at #IFA2019 in Berlin that #Mate30 series will be installed with #Android10, but will not carry any #Google apps when launched on Sept. 19. ' -China's National Business Daily",kaggle,,kaggle,GOOGL,SECTOR,0.5,0.05933079868555069
2019-09-09,2019-09-09T00:00:00,"Tennessee Attorney General Says Attorney Generals Will Be Looking Into Alphabet/Google Acquisitions, Cos. Google Took Stakes In Then Rolled Out Similar Products",kaggle,,kaggle,GOOGL,SECTOR,0.5,0.02921200916171074
2019-09-09,2019-09-09T00:00:00,Texas Attorney General Says Formal Doc Request Has Been Sent To Google Today,kaggle,,kaggle,GOOGL,SECTOR,0.5,-0.01833271235227585
2019-09-09,2019-09-09T00:00:00,Analysts React To Heavy Selling Pressure In The Tech Sector,kaggle,,kaggle,GOOGL,MARKET,0.2,-0.8577031493186951
2019-09-09,2019-09-09T00:00:00,App Auto Generates Google Shopping Ads For Shopify,kaggle,,kaggle,GOOGL,SECTOR,0.5,0.0038963444530963898
2019-09-09,2019-09-09T00:00:00,Treasury Secretary Says Meeting With Digital Companies This Week To Discuss France Digital Tax Issue,kaggle,,kaggle,GOOGL,MARKET,0.2,0.1031922772526741
2019-09-10,2019-09-10T00:00:00,IBM And Fraunhofer Join Forces On Quantum Computing Initiative For Germany,kaggle,,kaggle,IBM,SECTOR,0.5,0.42619994282722473
2019-09-10,2019-09-10T00:00:00,Tesla Option Alert: Fri $245 Calls at the Ask: 730 @ $0.42 vs 1635 OI; Earnings 10/23 After Close [est] Ref=$234.68,kaggle,,kaggle,TSLA,SECTOR,0.5,0.13438494503498077
2019-09-10,2019-09-10T00:00:00,Tesla Option Alert: Oct 18 $260 Calls Sweep (6) near the Ask: 500 @ $4.25 vs 2952 OI; Earnings 10/23 After Close [est] Ref=$233.23,kaggle,,kaggle,TSLA,SECTOR,0.5,0.04114878177642822
2019-09-10,2019-09-10T00:00:00,'Tesla adds pedestrian warning system to Model 3' -Electrek,kaggle,,kaggle,TSLA,SECTOR,0.5,0.33855292201042175
2019-09-10,2019-09-10T00:00:00,Tesla Option Alert: Fri $242.5 Calls Sweep (3) near the Ask: 1001 @ $0.557 vs 5838 OI; Earnings 10/23 After Close [est] Ref=$231.7,kaggle,,kaggle,TSLA,SECTOR,0.5,0.05007070302963257
2019-09-10,2019-09-10T00:00:00,Tesla Permit Application Hints at Another Fremont Assembly Line,kaggle,,kaggle,TSLA,SECTOR,0.5,0.4975718855857849
2019-09-10,2019-09-10T00:00:00,Game On: Nvidia Reportedly Working On Sub-$300 Graphics Card To Take On AMD,kaggle,,kaggle,NVDA,SECTOR,0.5,0.3573198914527893
2019-09-10,2019-09-10T00:00:00,'Tesla is working on 5th assembly line at Fremont factory ahead of Model Y production' -Electrek,kaggle,,kaggle,TSLA,SECTOR,0.5,0.09707173705101013
2019-09-10,2019-09-10T00:00:00,Google About to Launch Google Play Pass,kaggle,,kaggle,GOOGL,SECTOR,0.5,0.013450302183628082
2019-09-11,2019-09-11T00:00:00,Oracle CEO Mark Hurd To Take Leave Of Absence For Health-Related Reasons,kaggle,,kaggle,ORCL,SECTOR,0.5,-0.88258957862854
2019-09-11,2019-09-11T00:00:00,Follow-Through Wednesday? Stocks Look To Build On Late Tuesday Rally,kaggle,,kaggle,ORCL,MARKET,0.2,0.9043612480163574
2019-09-11,2019-09-11T00:00:00,"UPDATE: Oracle Founder, Chair, CTO Larry Ellison, CEO Safra Catz To Cover Hurd's Responsibilities In His Absence",kaggle,,kaggle,ORCL,SECTOR,0.5,0.00704389251768589
2019-09-11,2019-09-11T00:00:00,"Oracle Q1 Adj. EPS $0.81, Inline, Sales $9.218B Miss $9.29B Estimate",kaggle,,kaggle,ORCL,SECTOR,0.5,-0.05063048005104065
2019-09-11,2019-09-11T00:00:00,Oracle Corporation Adds $15B To Buyback,kaggle,,kaggle,ORCL,SECTOR,0.5,0.21336540579795837
2019-09-11,2019-09-11T00:00:00,Oracle Reports Q1 Sales Miss,kaggle,,kaggle,ORCL,SECTOR,0.5,0.0005035549402236938
2019-09-11,2019-09-11T00:00:00,"Tesla shares are trading higher. Not seeing any news to justify the price action. Note that the stock, after selling off following earnings, saw a high of $246.68. Bulls could be looking to fill that gap.",kaggle,,kaggle,TSLA,SECTOR,0.5,0.40247973799705505
2019-09-11,2019-09-11T00:00:00,'Tesla is installing a solar array at Fremont factory and new 24-stall Supercharger' -Electrek,kaggle,,kaggle,TSLA,SECTOR,0.5,0.2911749482154846
2019-09-11,2019-09-11T00:00:00,From Oracle Q1 Earnings Conference Call: Sees FY20 EPS Growth In Double Digit Range,kaggle,,kaggle,ORCL,SECTOR,0.5,0.9040234684944153
2019-09-11,2019-09-11T00:00:00,Shares of several semiconductor companies are trading higher after China released a tariff exemptions list for certain products from the U.S. Apple also released new iPhones which are expected to benefit several companies within the sector.,kaggle,,kaggle,NVDA,DIRECT,1.0,0.924452543258667
2019-09-11,2019-09-11T00:00:00,"From Oracle Q1 Earnings Conference Call: Sees Q2 Sales Up 1-3% On Constant Currency Basis, Adj. EPS $0.87-$0.89 vs $0.91 Estimate",kaggle,,kaggle,ORCL,SECTOR,0.5,0.9235861897468567
2019-09-11,2019-09-11T00:00:00,Salesforce.com shares are trading higher on seemingly no company-specific news. The stock could potentially be trading higher on optimism after China announced a tariff exemption list on some U.S. goods.,kaggle,,kaggle,CRM,SECTOR,0.5,0.9203218221664429
2019-09-11,2019-09-11T00:00:00,"Oracle, Tailored Brands Fall In Wednesday's After-Hours Session",kaggle,,kaggle,ORCL,SECTOR,0.5,-0.957879900932312
2019-09-11,2019-09-11T00:00:00,"Evercore ISI Group Initiates Coverage On Cisco Systems with Outperform Rating, Announces $60 Price Target",kaggle,,kaggle,CSCO,SECTOR,0.5,0.2656063437461853
2019-09-12,2019-09-12T00:00:00,"Morgan Stanley Maintains Equal-Weight, $59 Target On Oracle As Firm Notes 'While a no-growth opex profile and share repurchases keep EPS growth largely intact, the lack of revenue or op income growth likely keeps the multiple rangebound'",kaggle,,kaggle,ORCL,SECTOR,0.5,0.5931856632232666
2019-09-12,2019-09-12T00:00:00,"Barclays Maintains Equal-Weight on Oracle, Lowers Price Target to $57",kaggle,,kaggle,ORCL,SECTOR,0.5,0.31457847356796265
2019-09-12,2019-09-12T00:00:00,"BMO Capital Maintains Market Perform on Oracle, Raises Price Target to $60",kaggle,,kaggle,ORCL,SECTOR,0.5,0.8509275317192078
2019-09-12,2019-09-12T00:00:00,Oracle shares are trading lower after the market reported worse-than-expected Q1 sales results.,kaggle,,kaggle,ORCL,SECTOR,0.5,-0.9662184119224548
2019-09-12,2019-09-12T00:00:00,Oracle Reports Early In Surprise Move As Trump Surprises With Positive Trade Tweet,kaggle,,kaggle,ORCL,SECTOR,0.5,0.7847568988800049
2019-09-12,2019-09-12T00:00:00,"UPDATE: Barclays Maintains Market Perform On Oracle, Lowers Target To $57 As Firm's Revenue Estimates Move Lower Due To 'increased management conservatism triggered by:'",kaggle,,kaggle,ORCL,SECTOR,0.5,-0.9496421813964844
2019-09-12,2019-09-12T00:00:00,Hearing Toyota Is Using Panasonic Batteries Designed For Tesla Electric Cars In Its Own Plug-In Hybrids For Chinese Market,kaggle,,kaggle,TSLA,SECTOR,0.5,0.18102125823497772
2019-09-12,2019-09-12T00:00:00,"Oracle Shares Fall, Analysts Tepid After Shaky Q1 Print",kaggle,,kaggle,ORCL,SECTOR,0.5,-0.9477778673171997
2019-09-12,2019-09-12T00:00:00,Todd Gordon's Alphabet Options Trade,kaggle,,kaggle,GOOGL,SECTOR,0.5,0.0006425417959690094
2019-09-12,2019-09-12T00:00:00,"UPDATES: Barclays On Oracle Notes 'Such a set-up might work in a correcting market given an undemanding valuation, but is unlikely to lead to a sustained rally'",kaggle,,kaggle,ORCL,SECTOR,0.5,0.9043301939964294
2019-09-12,2019-09-12T00:00:00,Elon Musk Says Tesla's New Model S Prototype is a 7 Seater,kaggle,,kaggle,TSLA,SECTOR,0.5,0.0839369148015976
2019-09-12,2019-09-12T00:00:00,EU Court Says Germany Must Notify EU of Copyright Law Targeting Google,kaggle,,kaggle,GOOGL,SECTOR,0.5,-0.7379114031791687
2019-09-12,2019-09-12T00:00:00,"Tesla Rally Takes A Breather, But Option Market Suggests More Upside Ahead",kaggle,,kaggle,TSLA,SECTOR,0.5,-0.16950681805610657
2019-09-12,2019-09-12T00:00:00,"NLRB Says Google Must Tell Employees They Are Free to Speak Out About Work Conditions, Other Topics",kaggle,,kaggle,GOOGL,SECTOR,0.5,-0.14178147912025452
2019-09-12,2019-09-12T00:00:00,"Hearing Google Has Agreed To €500M Fine By French Authorities, Will Settle Fiscal Fraud Probe",kaggle,,kaggle,GOOGL,SECTOR,0.5,-0.3735942542552948
2019-09-12,2019-09-12T00:00:00,Google to Build Second Data Center in Taiwan,kaggle,,kaggle,GOOGL,SECTOR,0.5,0.18742650747299194
2019-09-13,2019-09-13T00:00:00,"Ford, GM Racing to Develop Electric Pickup Trucks to Compete Against Tesla",kaggle,,kaggle,TSLA,SECTOR,0.5,0.5437461137771606
2019-09-13,2019-09-13T00:00:00,'Tesla patents new longer lasting battery with better performance and cheaper cost' -Electrek,kaggle,,kaggle,TSLA,SECTOR,0.5,0.6742264628410339
2019-09-13,2019-09-13T00:00:00,"'Tesla Model S prototype shows new fascia, strange rear spoiler, and more ' -Electrek",kaggle,,kaggle,TSLA,SECTOR,0.5,0.15396462380886078
2019-09-15,2019-09-15T00:00:00,Dan Nathan's Alphabet Options Trade,kaggle,,kaggle,GOOGL,SECTOR,0.5,0.010993625968694687
2019-09-15,2019-09-15T00:00:00,"Bulls And Bears Of The Week: Altria, Apple, Caterpillar, Ford, Oracle And More",kaggle,,kaggle,ORCL,DIRECT,1.0,0.014197202399373055
2019-09-16,2019-09-16T00:00:00,'Drug dealers are peddling steroids on Facebook and YouTube' -Earlier Washington Post Article $,kaggle,,kaggle,GOOGL,SECTOR,0.5,-0.20918864011764526
2019-09-16,2019-09-16T00:00:00,Report: Tesla Might Be Expanding Its Gigafactory,kaggle,,kaggle,TSLA,SECTOR,0.5,0.9034843444824219
2019-09-16,2019-09-16T00:00:00,'Google will announce its answer to iPhone 11 on Oct. 15' -Tweets CNBC,kaggle,,kaggle,GOOGL,DIRECT,1.0,0.03015921637415886
2019-09-16,2019-09-16T00:00:00,'Here's what Google got from Fossil in its $40 million deal' -Wareable,kaggle,,kaggle,GOOGL,SECTOR,0.5,0.10157480090856552
2019-09-16,2019-09-16T00:00:00,Today's Pick-Up: Musk Invokes Amazon's Name Not In Vain; Using A Customer To Rake XPO,kaggle,,kaggle,TSLA,SECTOR,0.5,0.1530449241399765
2019-09-16,2019-09-16T00:00:00,Oracle Reports Its Cloud Infrastructure Achieved FedRAMP Authorization,kaggle,,kaggle,ORCL,SECTOR,0.5,0.04219066724181175
2019-09-16,2019-09-16T00:00:00,'Tesla appears to be preparing an expansion at Gigafactory 3' Electrek,kaggle,,kaggle,TSLA,SECTOR,0.5,0.5808706879615784
2019-09-17,2019-09-17T00:00:00,"Oracle, VMWare, Announced an Expanded Partnership to Help Customers Leverage the Companies' Enterprise Software and Cloud Solutions to Make the Move to the Cloud",kaggle,,kaggle,ORCL,SECTOR,0.5,0.8728725910186768
2019-09-17,2019-09-17T00:00:00,Adobe Falls On Lower Q4 Guidance,kaggle,,kaggle,ADBE,SECTOR,0.5,-0.9078907370567322
2019-09-17,2019-09-17T00:00:00,"Adobe Q3 EPS $2.05 Beats $1.97 Estimate, Sales $2.83B Beat $2.82B Estimate",kaggle,,kaggle,ADBE,SECTOR,0.5,0.3762287199497223
2019-09-17,2019-09-17T00:00:00,"Holding Pattern: Fed Meeting Coincides With Sizzling Geopolitics, FedEx Earnings",kaggle,,kaggle,ADBE,MARKET,0.2,-0.005153100937604904
2019-09-17,2019-09-17T00:00:00,A Preview Of Adobe's Q3 Earnings,kaggle,,kaggle,ADBE,SECTOR,0.5,-0.002837255597114563
2019-09-17,2019-09-17T00:00:00,Option Trader Makes Big Bet On 17% Upside In Salesforce,kaggle,,kaggle,CRM,SECTOR,0.5,0.782465934753418
2019-09-17,2019-09-17T00:00:00,"'Fast Money Halftime Report' Traders Share Their Thoughts On Cisco, Twitter And More",kaggle,,kaggle,CSCO,SECTOR,0.5,0.003637969493865967
2019-09-17,2019-09-17T00:00:00,"Adobe Sees Q4 Adj. EPS ~$2.25 vs $2.30 Estimate, Sales ~$2.97B vs $3.03B Est.",kaggle,,kaggle,ADBE,SECTOR,0.5,0.04867476224899292
2019-09-18,2019-09-18T00:00:00,Cisco Offered $7B+ for DataDog as Company Prepares IPO,kaggle,,kaggle,CSCO,SECTOR,0.5,0.6516309380531311
2019-09-18,2019-09-18T00:00:00,"UPDATE: Nomura Maintains Buy On Adobe, Lowers Target To $310 As Firm Notes 'F3Q earnings were a beat of both our estimates and the Street's, despite continued noisiness around increased competition and potential backlash from price increases'",kaggle,,kaggle,ADBE,SECTOR,0.5,0.0028548240661621094
2019-09-18,2019-09-18T00:00:00,"UPDATE: Nomura On Adobe Also Notes 'Both Document cloud and Experience cloud F3Q revenues also appear to be ahead of expectations at $307mn and $821mn, respectively, although the Experience cloud guide at ~23% may be a bit light'",kaggle,,kaggle,ADBE,SECTOR,0.5,0.9040706753730774
2019-09-18,2019-09-18T00:00:00,A Peek Into The Markets: US Stock Futures Edge Lower; All Eyes On Fed Decision,kaggle,,kaggle,ADBE,MARKET,0.2,-0.9260063767433167
2019-09-18,2019-09-18T00:00:00,Adobe shares are trading lower after the company issued Q4 EPS and sales guidance below analyst estimates.,kaggle,,kaggle,ADBE,SECTOR,0.5,-0.9651753902435303
2019-09-18,2019-09-18T00:00:00,"JP Morgan Maintains Neutral on Adobe, Lowers Price Target to $318",kaggle,,kaggle,ADBE,SECTOR,0.5,-0.2287430316209793
2019-09-18,2019-09-18T00:00:00,"BMO Capital Maintains Outperform on Adobe, Lowers Price Target to $310",kaggle,,kaggle,ADBE,SECTOR,0.5,-0.5722212195396423
2019-09-18,2019-09-18T00:00:00,"Citi Maintains Buy on Adobe, Lowers Price Target to $322",kaggle,,kaggle,ADBE,SECTOR,0.5,-0.21064837276935577
2019-09-18,2019-09-18T00:00:00,"Avaya, IBM Report Deal To Accelerate Hybrid Cloud Strategy, No Terms Disclosed",kaggle,,kaggle,IBM,SECTOR,0.5,0.18054988980293274
