date,datetime,headline,source,url,api_source,fetched_for_ticker,relevance_level,relevance_weight,sentiment_score
2020-03-17,2020-03-17T00:00:00,"Dept. Of Justice, FTC Could Seek Extensions To Complete Probes For Merger Reviews, Allergan, Raytheon, Google Deals Mentioned",kaggle,,kaggle,GOOGL,SECTOR,0.5,-0.1258230209350586
2020-03-17,2020-03-17T00:00:00,"Oppenheimer Maintains Outperform on Salesforce.com, Lowers Price Target to $165",kaggle,,kaggle,CRM,SECTOR,0.5,-0.695970892906189
2020-03-17,2020-03-17T00:00:00,"Shares of several technology, semiconductor and software companies are trading higher, rebounding from Monday's crash. Stocks may also potentially be getting a boost from expectations of further stimulus proposals.",kaggle,,kaggle,CRM,SECTOR,0.5,0.9219073057174683
2020-03-17,2020-03-17T00:00:00,"UPDATE: Apple Previously Announced Closing Of Retail Locations Til Mar. 27, Now Says 'Until Further Notice'",kaggle,,kaggle,AAPL,DIRECT,1.0,-0.8034766316413879
2020-03-17,2020-03-17T00:00:00,"Trump Says Will Expand Medicare Telehealth Service Offers, Working With Skype, Apple For FaceTime",kaggle,,kaggle,AAPL,DIRECT,1.0,0.9032790660858154
2020-03-17,2020-03-17T00:00:00,"Jefferies Reiterates Buy on Apple, Lowers Price Target to $320",kaggle,,kaggle,AAPL,DIRECT,1.0,-0.1148538589477539
2020-03-17,2020-03-17T00:00:00,"Morgan Stanley Maintains Overweight on Apple, Lowers Price Target to $328",kaggle,,kaggle,AAPL,DIRECT,1.0,-0.4874488115310669
2020-03-17,2020-03-17T00:00:00,Apple Hit With $1.2B Fine By French Antitrust Authorities,kaggle,,kaggle,AAPL,DIRECT,1.0,-0.9444238543510437
2020-03-17,2020-03-17T00:00:00,Apple shares are trading higher as tech stocks rebound following Monday's crash. Morgan Stanley analysts today maintained an overweight rating on the stock.,kaggle,,kaggle,AAPL,DIRECT,1.0,0.8437851071357727
2020-03-17,2020-03-17T00:00:00,Hearing Apple To Close All Retail Stores Until Further Notice,kaggle,,kaggle,AAPL,DIRECT,1.0,-0.8333694934844971
2020-03-17,2020-03-17T00:00:00,Adobe shares are trading higher as tech stocks rebound following Monday's crash. Oppenheimer analysts today maintained an Outperform rating on the stock and raised the price target from $375 to $410.,kaggle,,kaggle,ADBE,SECTOR,0.5,0.9122478365898132
2020-03-17,2020-03-17T00:00:00,"Oppenheimer Maintains Outperform on Adobe, Raises Price Target to $410",kaggle,,kaggle,ADBE,SECTOR,0.5,0.8464868068695068
2020-03-17,2020-03-17T00:00:00,"CFRA Maintains Buy on Adobe, Lowers Price Target to $359",kaggle,,kaggle,ADBE,SECTOR,0.5,-0.16558942198753357
2020-03-18,2020-03-18T00:00:00,Apple Unveils New iPad Pro And New MacBook Air,kaggle,,kaggle,AAPL,DIRECT,1.0,0.18852289021015167
2020-03-18,2020-03-18T00:00:00,"Shares of several technology, software and semiconductor companies are trading lower as equities sell off amid continued global coronavirus concerns. The virus has caused global economic disruption and negatively impacted stocks across sectors.",kaggle,,kaggle,AAPL,SECTOR,0.5,-0.9655877947807312
2020-03-18,2020-03-18T00:00:00,"Travel, Airline Stocks In Focus Amid Fresh Weakness; Amazon To Hire 100,000 Workers",kaggle,,kaggle,AAPL,SECTOR,0.5,0.739721953868866
2020-03-18,2020-03-18T00:00:00,"Morgan Stanley Maintains Overweight on NVIDIA, Lowers Price Target to $268",kaggle,,kaggle,NVDA,SECTOR,0.5,-0.34720179438591003
2020-03-18,2020-03-18T00:00:00,"Staples, Stay-At-Home Tech Stocks Holding Up, But Energy, Travel Washout Continues",kaggle,,kaggle,CSCO,SECTOR,0.5,0.4094665050506592
2020-03-18,2020-03-18T00:00:00,Hearing B Of A Global Upgrades Tesla From Underperform To Neutral; Unconfirmed,kaggle,,kaggle,TSLA,SECTOR,0.5,0.8404834270477295
2020-03-18,2020-03-18T00:00:00,"B of A Securities Upgrades Tesla to Neutral, Raises Price Target to $500",kaggle,,kaggle,TSLA,SECTOR,0.5,0.6381336450576782
2020-03-18,2020-03-18T00:00:00,Tesla shares are trading lower as equities fall amid the global coronavirus outbreak. The company's Fremont factory could also be forced to shut down temporarily as Alameda County said Tesla is not 'an essential business' as defined by the county.,kaggle,,kaggle,TSLA,SECTOR,0.5,-0.9632561802864075
2020-03-18,2020-03-18T00:00:00,"Benzinga Pro's Top 5 Stocks To Watch For Wed., Mar. 18, 2020: GIS, TSLA, BYND, ARMK, APRN",kaggle,,kaggle,TSLA,SECTOR,0.5,0.028293903917074203
2020-03-18,2020-03-18T00:00:00,Tesla Shares Drop As Alameda County Says Fremont Factory 'Not An Essential Business',kaggle,,kaggle,TSLA,SECTOR,0.5,-0.9564172625541687
2020-03-18,2020-03-18T00:00:00,Waymo Shuts Safety Driver-Monitored Autonomous Taxis Citing Coronavirus Fears,kaggle,,kaggle,GOOGL,SECTOR,0.5,-0.9417189955711365
2020-03-18,2020-03-18T00:00:00,Munster Says Tesla Can 'Survive' Multiple Quarters Of Fremont Factory Shutdown,kaggle,,kaggle,TSLA,SECTOR,0.5,-0.8237031102180481
2020-03-18,2020-03-18T00:00:00,"Alameda County Spokesperson Says Is In Talks With Tesla About Factory, Says Co. Must Move To Minimum Basic Operations, Comply With Health Order If Its Still Making Cars",kaggle,,kaggle,TSLA,SECTOR,0.5,0.020775962620973587
2020-03-18,2020-03-18T00:00:00,"'Tesla Will Reduce Its Factory Workforce And Remain Open, A Sheriff's Office Said' -BuzzFeed",kaggle,,kaggle,TSLA,SECTOR,0.5,-0.9211661219596863
2020-03-18,2020-03-18T00:00:00,Attorneys For California's Alameda County And City Of Fremont Discuss How To Respond To Tesla Factory Operating Despite Lockdown Order; Fremont Police Spokeswoman Says 'This Is All Very New And There Are A Lot Of Moving Parts',kaggle,,kaggle,TSLA,SECTOR,0.5,-0.26432329416275024
2020-03-18,2020-03-18T00:00:00,"Tesla Tells Employees It's Awaiting 'Final Word' On US Plant, Tells Workers 'No Changes' In Normal Assignments",kaggle,,kaggle,TSLA,SECTOR,0.5,-0.08861112594604492
2020-03-18,2020-03-18T00:00:00,"BofA Is Less Bearish On Tesla Now, Upgrades Stock",kaggle,,kaggle,TSLA,SECTOR,0.5,-0.15338462591171265
2020-03-18,2020-03-18T00:00:00,"UPDATE: B of A Securities Upgrades Tesla to Neutral, Raises PT to $500 Views Co. 'as a trailblazer in the electric vehicle market, and believe the company could be successful as demand for EVs increases over time' But Also Cites 4 Potential Risk Factors:",kaggle,,kaggle,TSLA,SECTOR,0.5,0.872330367565155
2020-03-18,2020-03-18T00:00:00,'Tesla Fremont factory is still operating despite Sheriff's order' -Electrek,kaggle,,kaggle,TSLA,SECTOR,0.5,0.5655539035797119
2020-03-18,2020-03-18T00:00:00,People Seen Going To Work At Tesla's Fremont Factory Despite Alameda County's Order For Lockdown,kaggle,,kaggle,TSLA,SECTOR,0.5,-0.5767202973365784
2020-03-18,2020-03-18T00:00:00,Here's How Much Investing $100 In The 2018 Nio IPO Would Be Worth Today,kaggle,,kaggle,TSLA,MARKET,0.2,0.027233578264713287
2020-03-19,2020-03-19T00:00:00,"Esports, Gaming Thrive, Adapt As Nation Grapples With Pandemic",kaggle,,kaggle,NVDA,DIRECT,1.0,0.5415223836898804
2020-03-19,2020-03-19T00:00:00,"Canaccord Genuity Maintains Hold on Tesla, Lowers Price Target to $400",kaggle,,kaggle,TSLA,SECTOR,0.5,-0.056217312812805176
2020-03-19,2020-03-19T00:00:00,"Morgan Stanley Upgrades Tesla On More Realistic Stock Price, Can Weather Coronavirus Downturn",kaggle,,kaggle,TSLA,SECTOR,0.5,0.8522545099258423
2020-03-19,2020-03-19T00:00:00,Tesla shares are trading higher after a Morgan Stanley analyst upgraded the company's stock from Underweight to Equal-Weight.,kaggle,,kaggle,TSLA,SECTOR,0.5,0.9349275827407837
2020-03-19,2020-03-19T00:00:00,"Canaccord Genuity Maintains Buy on Apple, Lowers Price Target to $300",kaggle,,kaggle,AAPL,DIRECT,1.0,0.1621982753276825
2020-03-19,2020-03-19T00:00:00,Will Big Tech Come To The Rescue Against COVID-19?,kaggle,,kaggle,AAPL,SECTOR,0.5,0.13549277186393738
2020-03-19,2020-03-19T00:00:00,'elon musk offers to build ventilators for hospitals in need. mayor of NYC accepts via Twitter' -Tweet Highlighted By CNBC's Carl Quintanilla; BZ NOTE: Musk Tweeted Referenced Did Not Suggest Musk Agreed To Make Ventilators,kaggle,,kaggle,TSLA,SECTOR,0.5,0.07131980359554291
2020-03-19,2020-03-19T00:00:00,"Fremont City, California Officials Will Meet With Tesla Over Compliance With Health Shut Down Order",kaggle,,kaggle,TSLA,SECTOR,0.5,-0.19752012193202972
2020-03-19,2020-03-19T00:00:00,"Morgan Stanley Maintains Equal-Weight on Cisco Systems, Lowers Price Target to $43",kaggle,,kaggle,CSCO,SECTOR,0.5,0.407635897397995
2020-03-19,2020-03-19T00:00:00,"Tesla To Shut Down Fremont Factory Due To Coronavirus, Says It Has Enough Cash To Survive",kaggle,,kaggle,TSLA,SECTOR,0.5,-0.8455771207809448
2020-03-19,2020-03-19T00:00:00,Tesla Says Cash Position At End Of Q4 Was $6.3B Before Recent $2.3B Capital Raise,kaggle,,kaggle,TSLA,SECTOR,0.5,-0.07231110334396362
2020-03-19,2020-03-19T00:00:00,"Wedbush Maintains Neutral on Tesla, Lowers Price Target to $425",kaggle,,kaggle,TSLA,SECTOR,0.5,-0.005062028765678406
2020-03-19,2020-03-19T00:00:00,Tesla Says Believes Level Of Liquidity Is Sufficient To Successfully Navigate An Extended Period Of Uncertainty; Says At End Of Q4 2019 Had Available Credit Lines Worth Approximately $3B Including Working Capital Lines,kaggle,,kaggle,TSLA,SECTOR,0.5,0.895828366279602
2020-03-19,2020-03-19T00:00:00,Tesla Reports It Will Temporarily Suspend Production In Fremont and New York,kaggle,,kaggle,TSLA,SECTOR,0.5,-0.928385317325592
2020-03-19,2020-03-19T00:00:00,Alameda County Spokesman California City Of Fremont Is Meeting With Tesla Today To Discuss Coronavirus Lockdown Order,kaggle,,kaggle,TSLA,SECTOR,0.5,-0.002753831446170807
2020-03-19,2020-03-19T00:00:00,"Morgan Stanley Upgrades Tesla to Equal-Weight, Lowers Price Target to $460",kaggle,,kaggle,TSLA,SECTOR,0.5,0.5467358827590942
2020-03-20,2020-03-20T00:00:00,"Why BofA Says AMD, Nvidia Are High-Quality, High-Beta Stocks In A Volatile Market",kaggle,,kaggle,AMD,SECTOR,0.5,0.06474173069000244
2020-03-20,2020-03-20T00:00:00,JP Morgan Upgrades Oracle to Overweight,kaggle,,kaggle,ORCL,SECTOR,0.5,0.6963803768157959
2020-03-20,2020-03-20T00:00:00,Ex-Uber Executive Pleads Guilty To Stealing Google's Trade Secrets,kaggle,,kaggle,GOOGL,SECTOR,0.5,-0.6369532346725464
2020-03-20,2020-03-20T00:00:00,"Wells Fargo Maintains Equal-Weight on Advanced Micro Devices, Lowers Price Target to $50",kaggle,,kaggle,AMD,SECTOR,0.5,0.7546067237854004
2020-03-20,2020-03-20T00:00:00,"Elon Musk Tweets: Yes, we're working on ventilators, even though I think they probably won't be needed",kaggle,,kaggle,TSLA,SECTOR,0.5,0.6889057755470276
2020-03-20,2020-03-20T00:00:00,"Registration of New Tesla Cars in China in February Declined 35% MoM, Following a 46% MoM Decline in January",kaggle,,kaggle,TSLA,SECTOR,0.5,-0.9654198288917542
2020-03-20,2020-03-20T00:00:00,Apple Limits Online iPhone Purchases To Two After Closing All Stores Outside China,kaggle,,kaggle,AAPL,DIRECT,1.0,-0.7268631458282471
2020-03-20,2020-03-20T00:00:00,"Wells Fargo Maintains Overweight on NVIDIA, Lowers Price Target to $280",kaggle,,kaggle,NVDA,SECTOR,0.5,-0.27169284224510193
2020-03-20,2020-03-20T00:00:00,Microsoft Teams Adds 12M Customers In A Week As Coronavirus Forces Remote Work Boom,kaggle,,kaggle,CSCO,SECTOR,0.5,-0.40154188871383667
2020-03-20,2020-03-20T00:00:00,"Tesla shares are trading higher, rebounding from after hours weakness when the company announced it will temporarily suspend production at its Freemont factory. The company said it believes liquidity is sufficient for a period of uncertainty.",kaggle,,kaggle,TSLA,SECTOR,0.5,0.7028347849845886
2020-03-21,2020-03-21T00:00:00,"Bulls And Bears Of The Week: Amazon, Boeing, Coca-Cola And More",kaggle,,kaggle,TSLA,SECTOR,0.5,0.01586153358221054
2020-03-21,2020-03-21T00:00:00,"Barron's Picks And Pans: Big Tech Picks, Bank Stocks Large and Small And More",kaggle,,kaggle,AAPL,SECTOR,0.5,0.029036592692136765
2020-03-22,2020-03-22T00:00:00,"President Trump Says Ford, GM, Tesla Getting Go Ahead to Make Ventilators",kaggle,,kaggle,TSLA,SECTOR,0.5,0.49191758036613464
2020-03-22,2020-03-22T00:00:00,"A New Arsenal? Trump Greenlights US Automakers To Produce Ventilators, Other Metal Products",kaggle,,kaggle,TSLA,SECTOR,0.5,0.5201905965805054
2020-03-22,2020-03-22T00:00:00,Elon Musk Says We Expect to Have Over 1200 Ventilators to Distribute This Week,kaggle,,kaggle,TSLA,SECTOR,0.5,0.6404226422309875
2020-03-23,2020-03-23T00:00:00,"Tesla shares are trading higher. US President Trump on Sunday said auto companies, including Tesla are being given the go ahead to make ventilators. Strength also potentially related to Monday morning Fed actions, which boosted stocks. UPDATE: Shares have reversed are are now trading lower.",kaggle,,kaggle,TSLA,SECTOR,0.5,-0.8709152340888977
2020-03-23,2020-03-23T00:00:00,'Tesla Semi electric truck spotted coming back from winter testing ahead of production' -Electrek,kaggle,,kaggle,TSLA,SECTOR,0.5,0.5927745699882507
2020-03-23,2020-03-23T00:00:00,Cisco Pledges $225M To Fight Global Coronavirus Pandemic,kaggle,,kaggle,AAPL,SECTOR,0.5,0.8592113256454468
2020-03-23,2020-03-23T00:00:00,Apple Dropped Two-device Limit on Online Purchases of iPhones,kaggle,,kaggle,AAPL,DIRECT,1.0,-0.5987886190414429
2020-03-23,2020-03-23T00:00:00,"How Tim Cook, Mark Zuckerberg And Other Tech CEOs Are Helping Fight The Global Pandemic",kaggle,,kaggle,AAPL,DIRECT,1.0,0.07511620968580246
2020-03-23,2020-03-23T00:00:00,"Nomura Instinet Maintains Neutral on Apple, Lowers Price Target to $225",kaggle,,kaggle,AAPL,DIRECT,1.0,-0.36534175276756287
2020-03-23,2020-03-23T00:00:00,"Shares of several financial services companies are trading lower after a coronavirus stimulus bill failed a procedural Senate vote on Sunday. The sector has been impacted by the virus, which has slowed economic activity and led to to rate cuts.",kaggle,,kaggle,IBM,MARKET,0.2,-0.9610274434089661
2020-03-23,2020-03-23T00:00:00,"Nomura Maintains Neutral on Cisco Systems, Lowers Price Target to $43",kaggle,,kaggle,CSCO,SECTOR,0.5,0.05900175869464874
2020-03-23,2020-03-23T00:00:00,White House Partners With IBM To Create Supercomputer Power To Combat COVID-19,kaggle,,kaggle,IBM,SECTOR,0.5,0.8996080160140991
2020-03-23,2020-03-23T00:00:00,"Nomura Maintains Buy on IBM, Lowers Price Target to $135",kaggle,,kaggle,IBM,SECTOR,0.5,0.044307827949523926
2020-03-23,2020-03-23T00:00:00,"Shares of some technology companies are trading lower amid market volatility. Sunday's fiscal stimulus bill failed a procedural senate vote while the Fed on Monday announced stimulus measures. NOTE: Sector is mixed, with some names up for the session.",kaggle,,kaggle,AAPL,MARKET,0.2,-0.9255362749099731
2020-03-23,2020-03-23T00:00:00,"Shares of several technology, software, and semiconductor companies are trading higher as stocks move higher following Monday morning Fed stimulus action.",kaggle,,kaggle,ADBE,SECTOR,0.5,0.9113765358924866
2020-03-23,2020-03-23T00:00:00,"Intel, AMD Say They're Operating Near Capacity Despite Coronavirus Disruptions",kaggle,,kaggle,AMD,SECTOR,0.5,0.8782739043235779
2020-03-23,2020-03-23T00:00:00,Foxconn Has Secured Enough Workers To Meet 'Seasonal Demand' At All Major Chinese Plants,kaggle,,kaggle,AAPL,MARKET,0.2,0.8998144865036011
2020-03-24,2020-03-24T00:00:00,Tesla shares are trading higher after UBS upgraded the company's stock from Sell to Neutral.,kaggle,,kaggle,TSLA,SECTOR,0.5,0.931382954120636
2020-03-24,2020-03-24T00:00:00,"Morgan Stanley Maintains Equal-Weight on Tesla, Lowers Price Target to $440",kaggle,,kaggle,TSLA,SECTOR,0.5,0.16204969584941864
2020-03-24,2020-03-24T00:00:00,"UPDATE: Argus Research Downgrades Tesla to Hold, Notes 'we expect the coronavirus pandemic to have a negative impact on vehicle deliveries.'",kaggle,,kaggle,TSLA,SECTOR,0.5,-0.9487330913543701
2020-03-24,2020-03-24T00:00:00,Argus Research Downgrades Tesla to Hold,kaggle,,kaggle,TSLA,SECTOR,0.5,-0.6734590530395508
2020-03-24,2020-03-24T00:00:00,"Citigroup Maintains Sell on Tesla, Lowers Price Target to $246",kaggle,,kaggle,TSLA,SECTOR,0.5,-0.24380184710025787
2020-03-24,2020-03-24T00:00:00,"Dave Portnoy And Jim Cramer Talk Stock Market, Nordic American And More",kaggle,,kaggle,AMD,MARKET,0.2,9.287521243095398e-05
2020-03-24,2020-03-24T00:00:00,"Elon Musk Donated 1,000 Ventilators to California Hospitals",kaggle,,kaggle,TSLA,SECTOR,0.5,0.09825283288955688
2020-03-24,2020-03-24T00:00:00,"Tesla Has Already Delivered 1,000 Ventilators To Help Hospitals Fight Pandemic, California Governor Says",kaggle,,kaggle,TSLA,SECTOR,0.5,0.8462235927581787
2020-03-24,2020-03-24T00:00:00,Google Surveys Users For Coronavirus Symptoms To Help Researchers Forecast Spread,kaggle,,kaggle,GOOGL,SECTOR,0.5,0.046384043991565704
2020-03-24,2020-03-24T00:00:00,Youtube To Reduce Video Quality Worldwide To Ease Strain On Internet Networks Due To Coronavirus,kaggle,,kaggle,GOOGL,SECTOR,0.5,-0.6736799478530884
2020-03-24,2020-03-24T00:00:00,"UPDATE: Argus Research On Tesla Also Notes 'in the near term, we believe that consumers will focus on basic concerns and expect consumer confidence and spending to take a major hit as consumers defer large discretionary purchases.'",kaggle,,kaggle,TSLA,SECTOR,0.5,0.8809152841567993
2020-03-24,2020-03-24T00:00:00,UBS Upgrades Tesla to Neutral,kaggle,,kaggle,TSLA,SECTOR,0.5,0.4781411588191986
2020-03-24,2020-03-24T00:00:00,"Argus Downgrades Tesla On Coronavirus Impact, Slashes 2020 Delivery Forecast By 19%",kaggle,,kaggle,TSLA,SECTOR,0.5,-0.9412103891372681
2020-03-24,2020-03-24T00:00:00,NVIDIA shares are trading higher as equities gain amid hopes of a US stimulus agreement. Needham also upgraded the company's stock from Hold to Buy.,kaggle,,kaggle,NVDA,SECTOR,0.5,0.9314867258071899
2020-03-24,2020-03-24T00:00:00,Apple Store Closures Could Leave Some Device Owners In The Lurch: Report,kaggle,,kaggle,AAPL,DIRECT,1.0,-0.9536817073822021
2020-03-24,2020-03-24T00:00:00,"Rise In Semiconductor, Cloud Computing Stocks Could Set Tone For Broader Economy",kaggle,,kaggle,AAPL,SECTOR,0.5,0.7761548757553101
2020-03-24,2020-03-24T00:00:00,"Needham Upgrades NVIDIA to Buy, Announces $270 Price Target",kaggle,,kaggle,NVDA,SECTOR,0.5,0.2691099941730499
2020-03-24,2020-03-24T00:00:00,RUMOR: Hearing Dealreporter Speculation China Has Reached A Deal For NVIDIA/Mellanox Deal,kaggle,,kaggle,NVDA,SECTOR,0.5,0.87388014793396
2020-03-24,2020-03-24T00:00:00,"UPDATE: Needham Upgrades NVIDIA To Buy, Announces $270 Target Notes 'During this uncertain time, superior balance sheets remain supreme'; Firm Believes 'GPUs for medical applications will ramp in light of the COVID-19 pandemic'",kaggle,,kaggle,NVDA,SECTOR,0.5,0.9277684688568115
2020-03-24,2020-03-24T00:00:00,Oracle Works With White House For Informal Testing Of Antimalarial Drugs For COVID-19 Effectiveness,kaggle,,kaggle,ORCL,SECTOR,0.5,0.37554335594177246
2020-03-24,2020-03-24T00:00:00,Nvidia Analyst Says Pandemic Creates More Data Center Demand,kaggle,,kaggle,NVDA,SECTOR,0.5,-0.05222173035144806
2020-03-24,2020-03-24T00:00:00,Apple Expects Stores To Start Re-Opening In First Half On April,kaggle,,kaggle,AAPL,DIRECT,1.0,0.18848372995853424
2020-03-24,2020-03-24T00:00:00,'Apple Expects to Start Reopening Stores in First Half of April' -Bloomberg,kaggle,,kaggle,AAPL,DIRECT,1.0,0.15544603765010834
2020-03-24,2020-03-24T00:00:00,"UPDATE: Needham On NVIDIA Notes 'we believe the transition to AI, whether from hyperscalers, enterprise or verticals, will accelerate during this COVID-19 outbreak as the shift to private and public cloud will grow'",kaggle,,kaggle,NVDA,SECTOR,0.5,0.8502938747406006
2020-03-25,2020-03-25T00:00:00,Tesla shares are trading higher as equities gain after the White House and Senate reached a $2 trillion stimulus deal aimed at supporting the economy.,kaggle,,kaggle,TSLA,SECTOR,0.5,0.7839657664299011
2020-03-25,2020-03-25T00:00:00,"Alphabet shares are trading lower, not currently seeing company news. NOTE: Equities have begun moving lower following Tuesday strength. The stock has since reversed and are trading higher.",kaggle,,kaggle,GOOGL,SECTOR,0.5,-0.8835040330886841
2020-03-25,2020-03-25T00:00:00,"Elon Musk's SpaceX Makes And Donates Face Shields, Protective Suits, Sanitizer For COVID-19 Healthcare Workers",kaggle,,kaggle,TSLA,SECTOR,0.5,0.04834873974323273
2020-03-25,2020-03-25T00:00:00,Google Gives 60-Day Extension To All Contractors Due To Pandemic,kaggle,,kaggle,GOOGL,SECTOR,0.5,-0.6854984760284424
2020-03-25,2020-03-25T00:00:00,"Microsoft, Facebook, Twitter Partner With WHO To Launch Coronavirus Hackathon",kaggle,,kaggle,GOOGL,SECTOR,0.5,0.014901425689458847
2020-03-25,2020-03-25T00:00:00,Apple Said to be Accelerating Production Relocation Outside China,kaggle,,kaggle,AAPL,DIRECT,1.0,0.9071057438850403
2020-03-25,2020-03-25T00:00:00,Tim Cook Announces Apple 10M Masks Donation To US Health Workers,kaggle,,kaggle,AAPL,DIRECT,1.0,0.2090258151292801
2020-03-25,2020-03-25T00:00:00,COVID-19 Crisis Could Make Big Tech Even Stronger,kaggle,,kaggle,AAPL,SECTOR,0.5,-0.787685751914978
2020-03-25,2020-03-25T00:00:00,"'Huawei is set to release its #P40 phone series on Thursday, a move that analysts predicted could help push up its phone shipments and even surpass major counterpart @Apple in the short term' -Tweet From China's Global Times Biz",kaggle,,kaggle,AAPL,DIRECT,1.0,0.92577064037323
2020-03-25,2020-03-25T00:00:00,Apple Shares Tank As Report Says New iPhone Launch Could Be Moved To Next Year,kaggle,,kaggle,AAPL,DIRECT,1.0,-0.635069727897644
2020-03-25,2020-03-25T00:00:00,Salesforce Says Will Not Conduct Significant Lay Offs Over Next 90 Days,kaggle,,kaggle,CRM,SECTOR,0.5,-0.7936608791351318
2020-03-25,2020-03-25T00:00:00,"Morgan Stanley Maintains Overweight on Salesforce.com, Lowers Price Target to $195",kaggle,,kaggle,CRM,SECTOR,0.5,-0.36209142208099365
2020-03-25,2020-03-25T00:00:00,"Morgan Stanley Maintains Equal-Weight on IBM, Lowers Price Target to $107",kaggle,,kaggle,IBM,SECTOR,0.5,0.23417586088180542
2020-03-25,2020-03-25T00:00:00,"Morgan Stanley Maintains Overweight on Adobe, Raises Price Target to $375",kaggle,,kaggle,ADBE,SECTOR,0.5,0.8523198962211609
2020-03-25,2020-03-25T00:00:00,"Apple's Tim Cook Says Has Been Able To 'Source 10M masks for the US and millions more' For Regions In Europe, Says ' Our ops teams are helping to find and purchase masks from our supply chain in coordination with governments around the world.'",kaggle,,kaggle,AAPL,DIRECT,1.0,0.8132010102272034
2020-03-25,2020-03-25T00:00:00,"Deutsche Bank Upgrades Apple to Buy, Announces $270 Price Target",kaggle,,kaggle,AAPL,DIRECT,1.0,0.25808456540107727
2020-03-25,2020-03-25T00:00:00,"Tesla, Wayfair And Other Profitable Short Trades Could Get A Short Covering Boost",kaggle,,kaggle,AAPL,SECTOR,0.5,-0.19875477254390717
2020-03-25,2020-03-25T00:00:00,"'Apple weighs delaying 5G iPhone launch by months, sources say' -Nikkei",kaggle,,kaggle,AAPL,DIRECT,1.0,-0.01716701313853264
2020-03-26,2020-03-26T00:00:00,"AMD Says Graphics IP Stolen, Vows To Take On Perpetrators",kaggle,,kaggle,AMD,SECTOR,0.5,-0.4285874664783478
2020-03-26,2020-03-26T00:00:00,Shares of several software companies are trading higher after the Senate passed a $2 trillion stimulus package in relief to the coronavirus pandemic. The coronavirus outbreak has caused many equities across sectors to be very volatile.,kaggle,,kaggle,ADBE,SECTOR,0.5,-0.8150901794433594
2020-03-26,2020-03-26T00:00:00,Tesla's Long-Term Prospects Remain Positive While Automakers Turn To Ventilators,kaggle,,kaggle,TSLA,SECTOR,0.5,0.9087470769882202
2020-03-26,2020-03-26T00:00:00,Tesla shares are trading lower despite overall market strength. Not currently seeing company-specific news from the session.,kaggle,,kaggle,TSLA,SECTOR,0.5,-0.883734405040741
2020-03-26,2020-03-26T00:00:00,Shares of several semiconductor companies are trading higher following a strong Q2 earnings report from Micron.,kaggle,,kaggle,AMD,SECTOR,0.5,0.9285866022109985
2020-03-26,2020-03-26T00:00:00,Tesla To Reopen New York Gigafactory To Make Ventilators For COVID-19 Patients,kaggle,,kaggle,TSLA,SECTOR,0.5,0.4631402790546417
2020-03-26,2020-03-26T00:00:00,"SunTrust Robinson Humphrey Maintains Buy on Alphabet, Lowers Price Target to $1350",kaggle,,kaggle,GOOGL,SECTOR,0.5,-0.037426166236400604
2020-03-26,2020-03-26T00:00:00,Slack To Integrate With Microsoft Teams For Cross-Platform Calls,kaggle,,kaggle,CSCO,SECTOR,0.5,0.35814139246940613
2020-03-27,2020-03-27T00:00:00,"'Biggest value Tesla is providing is precise delivery of ventilators exactly to the ICU where & when they're needed. There are many ventilators in warehouses, but stuck in logistics/routing/paperwork issues' -Elon Musk Tweet",kaggle,,kaggle,TSLA,SECTOR,0.5,-0.027898654341697693
2020-03-27,2020-03-27T00:00:00,"Hearing New Street Upgrades Tesla From Neutral To Buy, Announces $800 Target",kaggle,,kaggle,TSLA,SECTOR,0.5,0.5227137804031372
2020-03-27,2020-03-27T00:00:00,"Benzinga Founder, CEO Jason Raznick To Appear On Benzinga's PreMarket Prep Morning Trading Show at 8:45 a.m. EDT; Will Be Talking Overall Market, Tesla, Peloton, Smile Direct Club and Dividend Stock Ideas; premarket.benzinga.com",kaggle,,kaggle,TSLA,SECTOR,0.5,0.03378583863377571
2020-03-27,2020-03-27T00:00:00,"Piper Sandler Maintains Overweight on Tesla, Lowers Price Target to $820",kaggle,,kaggle,TSLA,SECTOR,0.5,-0.09715023636817932
2020-03-27,2020-03-27T00:00:00,"'Tesla Gigafactory Shanghai makes 3,000 cars per week amid other factory shutdowns' -Electrek",kaggle,,kaggle,TSLA,SECTOR,0.5,-0.5740081071853638
2020-03-27,2020-03-27T00:00:00,Tesla To Reduce 75% Of All On-Site Staff At Nevada Gigafactory Due To Pandemic,kaggle,,kaggle,TSLA,SECTOR,0.5,-0.9616470336914062
2020-03-27,2020-03-27T00:00:00,"Hearing Piper Sandler Says Tesla Should Be Bought On Recent 'Market Dislocation', Has $820 Price Target",kaggle,,kaggle,TSLA,SECTOR,0.5,0.060149360448122025
