date,datetime,headline,source,url,api_source,fetched_for_ticker,relevance_level,relevance_weight,sentiment_score
2019-01-02,2019-01-02T00:00:00,Tech stocks shares are trading lower after Apple cut Q1 sales guidance drastically.,kaggle,,kaggle,CSCO,DIRECT,1.0,-0.9616672992706299
2019-01-03,2019-01-03T00:00:00,"Immersion Reports Deal With Google To Develop Next-Gen Haptic Devices, No Terms Disclosed",kaggle,,kaggle,GOOGL,SECTOR,0.5,0.04874878376722336
2019-01-03,2019-01-03T00:00:00,"Alphabet's Verily Life Sciences Unit Reports $1B Investment Round Led By Silver Lake To Advance Plans On Business Strategies Which Are Additive, Complementary To Its Current Life Sciences Portfolio",kaggle,,kaggle,GOOGL,SECTOR,0.5,0.8729965686798096
2019-01-03,2019-01-03T00:00:00,Several Apple supplier shares are trading lower after Apple lowered Q1 sales expectations by 7.7%.,kaggle,,kaggle,NVDA,DIRECT,1.0,-0.965192437171936
2019-01-03,2019-01-03T00:00:00,Canaccord Genuity Upgrades Alphabet to Buy,kaggle,,kaggle,GOOGL,SECTOR,0.5,0.23022784292697906
2019-01-03,2019-01-03T00:00:00,Shares of several tech stocks are trading down after Apple cut Q1 sales guidance.,kaggle,,kaggle,ADBE,DIRECT,1.0,-0.9629868865013123
2019-01-04,2019-01-04T00:00:00,"Goldman Sees Amazon, Alphabet, PayPal, GrubHub, Netflix As Best Risk/Reward In US Internet Space, Sees Spotify, Twitter As Stocks Which Offer Most Upside From Current Levels",kaggle,,kaggle,GOOGL,SECTOR,0.5,0.8491349816322327
2019-01-04,2019-01-04T00:00:00,Google Expects Google Assistant To Be On 1 Billion Devices By The End Of January,kaggle,,kaggle,GOOGL,SECTOR,0.5,0.11250084638595581
2019-01-06,2019-01-06T00:00:00,"Benzinga's Bulls & Bears Of The Week: Amazon, CBS, Intel, Nike, Tesla And More",kaggle,,kaggle,GOOGL,SECTOR,0.5,0.015925968065857887
2019-01-07,2019-01-07T00:00:00,Salesforce.Com shares are trading higher after Pivotal Research upgraded the stock from Hold to Buy and raised the price target from $140 to $164.,kaggle,,kaggle,CRM,SECTOR,0.5,0.9291632175445557
2019-01-07,2019-01-07T00:00:00,Juniper Networks Enters Master Service Agreement With IBM,kaggle,,kaggle,IBM,SECTOR,0.5,0.8313974738121033
2019-01-07,2019-01-07T00:00:00,"Wedbush Adds Salesforce To Its Wedbush Best Idea List 'on MuleSoft traction, ample room for upside, and valuation'",kaggle,,kaggle,CRM,SECTOR,0.5,0.8698491454124451
2019-01-07,2019-01-07T00:00:00,Salesforce's M&A Earns Cloud Company A Spot On Wedbush's 'Best Ideas List',kaggle,,kaggle,CRM,SECTOR,0.5,0.8986722826957703
2019-01-07,2019-01-07T00:00:00,"Pivotal Research Upgrades Alphabet to Buy, Raises Price Target to $1.24K",kaggle,,kaggle,GOOGL,SECTOR,0.5,0.3855285346508026
2019-01-07,2019-01-07T00:00:00,"Pivotal Research Upgrades Salesforce.com to Buy, Raises Price Target to $164",kaggle,,kaggle,CRM,SECTOR,0.5,0.7600691914558411
2019-01-07,2019-01-07T00:00:00,"Jon Najarian Sees Big Options Activity In Johnson & Johnson, Nvidia",kaggle,,kaggle,NVDA,SECTOR,0.5,0.3631672263145447
2019-01-07,2019-01-07T00:00:00,NVIDIA Introduces DRIVE AutoPilot Automated Driving System,kaggle,,kaggle,NVDA,SECTOR,0.5,0.0446571409702301
2019-01-07,2019-01-07T00:00:00,Google Announces Launch Of Smart Displays For Google Assistant,kaggle,,kaggle,GOOGL,SECTOR,0.5,0.21038560569286346
2019-01-07,2019-01-07T00:00:00,"Pivotal Forecasts Good Year For Online Ads, Upgrades Adobe, Alphabet, Salesforce",kaggle,,kaggle,ADBE,SECTOR,0.5,0.7131227254867554
2019-01-07,2019-01-07T00:00:00,"Pivotal Research Upgrades Adobe to Buy, Raises Price Target to $262",kaggle,,kaggle,ADBE,SECTOR,0.5,0.4619128406047821
2019-01-07,2019-01-07T00:00:00,MercuryGate Taps Oracle Executive As CTO; Outsider To Oversee Company's IT Infrastructure,kaggle,,kaggle,ORCL,SECTOR,0.5,0.05012602359056473
2019-01-07,2019-01-07T00:00:00,NVIDIA shares are trading higher after the company announced a new gaming chip at CES 2019.,kaggle,,kaggle,NVDA,SECTOR,0.5,0.9282883405685425
2019-01-08,2019-01-08T00:00:00,Larry Ellison Invests $1B In Tesla,kaggle,,kaggle,ORCL,SECTOR,0.5,0.04385341703891754
2019-01-08,2019-01-08T00:00:00,4 Tech Stocks That Are Showing Signs Of Life Right Now,kaggle,,kaggle,NVDA,SECTOR,0.5,0.49291595816612244
2019-01-08,2019-01-08T00:00:00,"IBM Announces $540 Million Multi-year Agreement With Nordea, Under Which Nordea Bank Will Outsource Its IBM Z Operations to IBM",kaggle,,kaggle,IBM,SECTOR,0.5,0.7794172167778015
2019-01-08,2019-01-08T00:00:00,Credit Suisse Sounds Alarm On Risks To Nvidia Estimates,kaggle,,kaggle,NVDA,SECTOR,0.5,-0.8733079433441162
2019-01-08,2019-01-08T00:00:00,Semiconductor stocks are trading lower after Goldman Sachs analysts announced they expect a 'challenging' 2019 for the space.,kaggle,,kaggle,NVDA,SECTOR,0.5,-0.9628122448921204
2019-01-08,2019-01-08T00:00:00,Goldman Sachs Shares Semiconductor Stock Picks For A Challenging 2019,kaggle,,kaggle,NVDA,SECTOR,0.5,-0.4400067925453186
2019-01-09,2019-01-09T00:00:00,"Atlantic Equities Initiates Coverage On Adobe with Neutral Rating, Announces $250 Price Target",kaggle,,kaggle,ADBE,SECTOR,0.5,0.05925436317920685
2019-01-09,2019-01-09T00:00:00,"Atlantic Equities Initiates Coverage On Salesforce.com with Overweight Rating, Announces $179 Price Target",kaggle,,kaggle,CRM,SECTOR,0.5,0.2572357654571533
2019-01-09,2019-01-09T00:00:00,"Atlantic Equities Initiates Coverage On Oracle with Underweight Rating, Announces $45 Price Target",kaggle,,kaggle,ORCL,SECTOR,0.5,0.23555736243724823
2019-01-09,2019-01-09T00:00:00,"Barclays Downgrades Oracle to Equal-Weight, Lowers Price Target to $55",kaggle,,kaggle,ORCL,SECTOR,0.5,-0.11071932315826416
2019-01-09,2019-01-09T00:00:00,Adobe shares are trading higher after Atlantic Equities initiated coverage on the stock with a Neutral rating and a price target of $250.,kaggle,,kaggle,ADBE,SECTOR,0.5,0.8047435879707336
2019-01-10,2019-01-10T00:00:00,Nvidia's Huang Dismisses Rival AMD's Latest Graphics Card As 'Underwhelming',kaggle,,kaggle,NVDA,SECTOR,0.5,-0.8813762664794922
2019-01-10,2019-01-10T00:00:00,EU Court Adviser Says Google Can Limit Right to be Forgotten to EU,kaggle,,kaggle,GOOGL,SECTOR,0.5,-0.03442453220486641
2019-01-10,2019-01-10T00:00:00,"Alphabet, Inc. Board Sued On Thursday In California State Court By Shareholder; Lawsuit Alleges Board Breached Fiduciary Duty By Covering Up Sexual Misconduct By Top Execs, Cites Meeting Minutes From 2024-2016",kaggle,,kaggle,GOOGL,SECTOR,0.5,-0.9331803917884827
2019-01-12,2019-01-12T00:00:00,"Benzinga's Bulls & Bears Of The Week: Delta Air, McDonald's, Netflix, Nokia, Tesla And More",kaggle,,kaggle,NVDA,SECTOR,0.5,0.017407093197107315
2019-01-14,2019-01-14T00:00:00,"UPDATE: Global Equities' Chowdhry Sees Recent Crackdown On Crypto Miners As Creating A Temporary Compute Overcapacity In The 'Super Cloud' Cos., Sees Intel Datacenter Business Experiencing Temporary Issues",kaggle,,kaggle,GOOGL,SECTOR,0.5,-0.9538160562515259
2019-01-14,2019-01-14T00:00:00,"UPDATE: Global Equities' Chowdhry Warns Could Take Another 2 Qtrs. For Amazon's AWS, Microsoft's Azure, Google's GCP To Clean Their Workloads From Crypto Miners Abuse",kaggle,,kaggle,GOOGL,SECTOR,0.5,-0.17115887999534607
2019-01-14,2019-01-14T00:00:00,'Google employees are launching a social media blitz to pressure tech giants on workplace harassment issues' -Recode,kaggle,,kaggle,GOOGL,SECTOR,0.5,-0.6385852694511414
2019-01-15,2019-01-15T00:00:00,"Morgan Stanley Downgrades Oracle to Equal-Weight, Lowers Price Target to $53",kaggle,,kaggle,ORCL,SECTOR,0.5,-0.367474764585495
2019-01-16,2019-01-16T00:00:00,"Alphabet, McDonald's, Netflix, Xilinx: 'Fast Money' Picks For January 16",kaggle,,kaggle,GOOGL,SECTOR,0.5,0.030815526843070984
2019-01-16,2019-01-16T00:00:00,"Tech Sector Earnings: Revenue Growth Widely Expected To Slow, Will Global Uncertainty Weigh?",kaggle,,kaggle,CRM,MARKET,0.2,-0.9145167469978333
2019-01-16,2019-01-16T00:00:00,Salesforce in Talks to Buy ClickSoftware for $1.5B from Francisco Partners,kaggle,,kaggle,CRM,SECTOR,0.5,0.1015162542462349
2019-01-16,2019-01-16T00:00:00,"IBM Reports Its Services Unit Reached $325M Deal With Juniper Networks Under Which IBM Will Assist Juniper In Managing Existing Infrastructure, App, IT Services",kaggle,,kaggle,IBM,SECTOR,0.5,0.9035390615463257
2019-01-16,2019-01-16T00:00:00,Red Hat 8-K Shows Shareholders At Special Meeting Approved Deal With IBM,kaggle,,kaggle,IBM,SECTOR,0.5,0.23093341290950775
2019-01-17,2019-01-17T00:00:00,"Stephens & Co. Initiates Coverage On Adobe with Equal-Weight Rating, Announces $278 Price Target",kaggle,,kaggle,ADBE,SECTOR,0.5,0.2418385148048401
2019-01-17,2019-01-17T00:00:00,"The EU is Preparing a Third Antitrust Fine for Google's Adsense, According to Bloomberg",kaggle,,kaggle,GOOGL,SECTOR,0.5,-0.8447219133377075
2019-01-17,2019-01-17T00:00:00,"Stephens & Co. Initiates Coverage On Salesforce.com with Overweight Rating, Announces $183 Price Target",kaggle,,kaggle,CRM,SECTOR,0.5,0.18649041652679443
2019-01-17,2019-01-17T00:00:00,Google Buys Smartwatch Tech And Know-How From Fossil,kaggle,,kaggle,GOOGL,SECTOR,0.5,0.07360921800136566
2019-01-17,2019-01-17T00:00:00,"JP Morgan Sees A 'Solid entry point for long-term investors - top pick remains AVGO, and we also favor NVDA, INTC, MXIM, MU, IPHI and MLNX' As Firm Sees 'value in semi stocks' And Thinks 'weak sentiment and estimate cuts are largely priced' IN",kaggle,,kaggle,NVDA,SECTOR,0.5,0.8520323038101196
2019-01-17,2019-01-17T00:00:00,"Hearing M Science Initiated Positive Coverage On Adobe, Citing Revenue Strength; Unconfirmed",kaggle,,kaggle,ADBE,SECTOR,0.5,0.900924801826477
2019-01-18,2019-01-18T00:00:00,Shares of semiconductor stocks are trading higher potentially due to renewed optimism in US-China relations.,kaggle,,kaggle,NVDA,SECTOR,0.5,0.9258955717086792
2019-01-22,2019-01-22T00:00:00,IBM To Report Q4 Earnings After The Closing Bell; Co. Historically Issues Its Report Before 4:10 p.m. ET,kaggle,,kaggle,IBM,SECTOR,0.5,-0.04786605387926102
2019-01-22,2019-01-22T00:00:00,"IBM Q4 Adj. EPS $4.87 Beats $4.84 Estimate, Sales $21.76B Beat $21.75B Estimate",kaggle,,kaggle,IBM,SECTOR,0.5,0.5940738320350647
2019-01-22,2019-01-22T00:00:00,IBM Sees FY19 Adj. EPS Of At Least $13.90 vs $13.84 Est.; Sees Free Cash Flow Of Approximately $12B,kaggle,,kaggle,IBM,SECTOR,0.5,0.896363377571106
2019-01-22,2019-01-22T00:00:00,"IBM Rises After Q4 Earnings Beat, Cloud Revenue Up 12%",kaggle,,kaggle,IBM,SECTOR,0.5,0.9178479909896851
2019-01-22,2019-01-22T00:00:00,US Labor Department Files Complaint Against Oracle,kaggle,,kaggle,ORCL,SECTOR,0.5,-0.8923506736755371
2019-01-22,2019-01-22T00:00:00,Pivotal Makes No Changes To Google Model As Big Brands Flock Back To YouTube,kaggle,,kaggle,GOOGL,SECTOR,0.5,0.038887009024620056
2019-01-22,2019-01-22T00:00:00,Waymo Looks To The Motor City For Autonomous Vehicle Plant,kaggle,,kaggle,GOOGL,SECTOR,0.5,0.14238326251506805
2019-01-22,2019-01-22T00:00:00,"'Elliott Thinks Walmart, Google And Private Equity Could Be Interested In Buying Ebay's Core Marketplace Business For About $15 Billion' -CNBC",kaggle,,kaggle,GOOGL,SECTOR,0.5,0.3204652667045593
2019-01-22,2019-01-22T00:00:00,Chip and semiconductor stocks are trading lower; Dip may be related to ongoing concerns over China growth and trade talks.,kaggle,,kaggle,NVDA,SECTOR,0.5,-0.9632475972175598
2019-01-23,2019-01-23T00:00:00,"Big Chip Earnings Preview: Intel, AMD Set To Report Amid Changing Competitive Landscape, Cycle Risk",kaggle,,kaggle,NVDA,SECTOR,0.5,0.3374921381473541
2019-01-23,2019-01-23T00:00:00,"Google Signs Long-term Agreement To Purchase The Output Of A 10-megawatt Solar Array In Tainan City, Taiwan",kaggle,,kaggle,GOOGL,SECTOR,0.5,0.8992063999176025
2019-01-23,2019-01-23T00:00:00,"Oracle Issues Statement Regarding Lawsuit, Says Suit Is 'Meritless' And Relies On Cherry Picked Statistics'",kaggle,,kaggle,ORCL,SECTOR,0.5,-0.7679817080497742
2019-01-23,2019-01-23T00:00:00,Adobe Acquires Allegorithmic; Terms Not Disclosed,kaggle,,kaggle,ADBE,SECTOR,0.5,0.0022627171128988266
2019-01-23,2019-01-23T00:00:00,Najarians On CNBC Mention Cisco Systems And Amarin As Unusual Options Plays,kaggle,,kaggle,CSCO,SECTOR,0.5,0.038588568568229675
2019-01-23,2019-01-23T00:00:00,IBM shares are trading higher after the company reported better than expected Q4 EPS and revenue results.,kaggle,,kaggle,IBM,SECTOR,0.5,0.9271540641784668
2019-01-23,2019-01-23T00:00:00,Analysts Debate IBM: One-Time Fluke Or Sustainable Recovery?,kaggle,,kaggle,IBM,SECTOR,0.5,0.018433675169944763
2019-01-24,2019-01-24T00:00:00,Analyst Says Apple's App Store Spending Is Likely To Slow In 2019,kaggle,,kaggle,GOOGL,DIRECT,1.0,-0.961122453212738
2019-01-24,2019-01-24T00:00:00,Oracle Comments on Google's Petition For Review By Supreme Court; Says Petition Presents a 'Rehash Of Arguments That Have Already Been Thoughtfully And Thoroughly Discredited',kaggle,,kaggle,GOOGL,SECTOR,0.5,-0.8506873250007629
2019-01-24,2019-01-24T00:00:00,Stocks in the semiconductor space are trading down following concerning earnings reports from Western Digital and Intel; Intel also issued weak guidance estimates.,kaggle,,kaggle,NVDA,SECTOR,0.5,-0.9672998785972595
2019-01-24,2019-01-24T00:00:00,"Market Seems Generally Pleased With Earnings Results, But Geopolitics Still Weigh",kaggle,,kaggle,IBM,MARKET,0.2,0.46636509895324707
2019-01-24,2019-01-24T00:00:00,"IBM Nails Earnings, But May Be Overbought In The Near Term",kaggle,,kaggle,IBM,SECTOR,0.5,0.4537504315376282
2019-01-24,2019-01-24T00:00:00,"Other Semi Stocks Fall Following Concerning Earnings From Intel, Western Digital: NVIDIA Shares Down 2.7%, AMD Down 2.5%, Seagate Down 2.4%, Micron Down 2.1%,",kaggle,,kaggle,NVDA,SECTOR,0.5,-0.9616379737854004
2019-01-24,2019-01-24T00:00:00,Semiconductor stocks are trading higher following strong earnings from multiple large companies in the space.,kaggle,,kaggle,NVDA,SECTOR,0.5,0.9322481751441956
2019-01-24,2019-01-24T00:00:00,Google Has Asked Supreme Court To Reverse Its Ruling Which Revived Oracle Copyright Case,kaggle,,kaggle,GOOGL,SECTOR,0.5,-0.8875728249549866
2019-01-25,2019-01-25T00:00:00,'Continuing our work to improve recommendations on YouTube' -YouTube Blog,kaggle,,kaggle,GOOGL,SECTOR,0.5,0.24304257333278656
2019-01-25,2019-01-25T00:00:00,Adobe Filing Shows Registration For Mixed Securities Offering,kaggle,,kaggle,ADBE,SECTOR,0.5,-0.014799322932958603
2019-01-25,2019-01-25T00:00:00,IC Insights Reports Semiconductor Unit Shipments Topped 1 Trillion In 2018,kaggle,,kaggle,NVDA,SECTOR,0.5,0.8489828705787659
2019-01-25,2019-01-25T00:00:00,Adobe Says Does Not Anticipate Paying Any Cash Dividends In The Foreseeable Future,kaggle,,kaggle,ADBE,SECTOR,0.5,0.006529908627271652
2019-01-25,2019-01-25T00:00:00,Hearing Jefferies Removes NVIDIA From Franchise Pick List; Unconfirmed,kaggle,,kaggle,NVDA,SECTOR,0.5,-0.32645168900489807
2019-01-25,2019-01-25T00:00:00,NVIDIA shares are trading lower potentially on rumors that Jefferies removed the stock from their Franchise Pick List.,kaggle,,kaggle,NVDA,SECTOR,0.5,-0.9656686186790466
2019-01-25,2019-01-25T00:00:00,BZ NOTE: Adobe Has Not Paid Cash Dividend Since 2005,kaggle,,kaggle,ADBE,SECTOR,0.5,-0.1916065663099289
2019-01-28,2019-01-28T00:00:00,NVIDIA Cuts Q4 Sales Guidance From $2.7B To $2.2B vs $2.7B Est.,kaggle,,kaggle,NVDA,SECTOR,0.5,-0.9160500764846802
2019-01-28,2019-01-28T00:00:00,NVIDIA Cuts Q4 Gross Margin Guidance From ~62.5% To ~56.0%,kaggle,,kaggle,NVDA,SECTOR,0.5,-0.8302402496337891
2019-01-28,2019-01-28T00:00:00,"NVIDIA Guidance Cut Reflects 'Weaker Than Forecasted' Sales Of Its Gaming And Datacenter Platforms,",kaggle,,kaggle,NVDA,SECTOR,0.5,-0.9661016464233398
2019-01-28,2019-01-28T00:00:00,"Inuvo Announced Its Vertro Subsidiary Entered Into Amendment Number One To Google Services Agreement; Pursuant To Agreement, Among Other Things, Payment Terms Were Modified And Term Of Agreement Was Extended To Feb 28, 2021",kaggle,,kaggle,GOOGL,SECTOR,0.5,0.0783948302268982
2019-01-28,2019-01-28T00:00:00,"Shares of NVIDIA are trading lower after the company cut Q4 guidance, citing weaker sales in its gaming and datacenter platforms.",kaggle,,kaggle,NVDA,SECTOR,0.5,-0.9658488631248474
2019-01-28,2019-01-28T00:00:00,"Nvidia Cuts Q4 Sales Guidance, Chips Stocks Tumble",kaggle,,kaggle,NVDA,SECTOR,0.5,-0.921902596950531
2019-01-28,2019-01-28T00:00:00,"NVIDIA Shares Down 9% Following Q4 Sales, Gross Margin Guidance Cut; AMD Shares Down 4.3%, Seagate Down 3.2%, Micron Down 2.5%, Intel, Western Digital Down 1.5%, Texas Instruments Down 1%",kaggle,,kaggle,NVDA,SECTOR,0.5,-0.9637967944145203
2019-01-28,2019-01-28T00:00:00,"VanEck Vectors Semiconductor ETF Down 2.4% Following Q4 Sales, Gross Margin Guidance Cut From NVIDIA",kaggle,,kaggle,NVDA,SECTOR,0.5,-0.9663223624229431
2019-01-29,2019-01-29T00:00:00,Nvidia shares are trading lower on continued weakness; Multiple analyst have downgraded the stock and cut price targets following the company's guidance cut.,kaggle,,kaggle,NVDA,SECTOR,0.5,-0.9670484066009521
2019-01-29,2019-01-29T00:00:00,"UPDATE: Needham Downgrades NVIDIA And Removes $225 Price Target As Firm Believes 'end demand will deteriorate further in its core markets, gaming (54% of sales) and datacenter (25%) driven by an ongoing deceleration in the Chinese economy'",kaggle,,kaggle,NVDA,SECTOR,0.5,-0.9594148397445679
2019-01-29,2019-01-29T00:00:00,"Top 3 Price Prediction Bitcoin, Ripple, Ethereum: Suffers Amid NVidia And QuadrigaCX As Technical Levels Weigh",kaggle,,kaggle,NVDA,SECTOR,0.5,0.26563605666160583
2019-01-29,2019-01-29T00:00:00,"UBS Turns Bullish On Nvidia After Guidance Cut, Sees Buying Opportunity",kaggle,,kaggle,NVDA,SECTOR,0.5,0.6320549249649048
2019-01-29,2019-01-29T00:00:00,"Morgan Stanley Downgrades Nvidia, Faces 'More Significant Challenges' Than Expected",kaggle,,kaggle,NVDA,SECTOR,0.5,-0.6676301956176758
2019-01-29,2019-01-29T00:00:00,Analysts React To Nvidia's Guidance Cut,kaggle,,kaggle,NVDA,SECTOR,0.5,0.04959386587142944
2019-01-29,2019-01-29T00:00:00,"UPDATE: Morgan Stanley Downgrades NVIDIA As Firm Notes 'Missing the quarter this badly in gaming indicates more significant challenges than we had anticipated, given that this is still a channel fill quarter for midrange/high end'",kaggle,,kaggle,NVDA,SECTOR,0.5,-0.9572852849960327
2019-01-29,2019-01-29T00:00:00,Needham Downgrades NVIDIA to Underperform,kaggle,,kaggle,NVDA,SECTOR,0.5,-0.9429433941841125
2019-01-29,2019-01-29T00:00:00,"Morgan Stanley Downgrades NVIDIA to Equal-Weight, Lowers Price Target to $148",kaggle,,kaggle,NVDA,SECTOR,0.5,-0.2127162218093872
2019-01-29,2019-01-29T00:00:00,"UBS Upgrades NVIDIA to Buy, Lowers Price Target to $180",kaggle,,kaggle,NVDA,SECTOR,0.5,0.6890036463737488
2019-01-29,2019-01-29T00:00:00,Morgan Stanley Downgrades Nvidia to Equal-Weight from Overweigth; Lowers Prices Target to $148 from $220,kaggle,,kaggle,NVDA,SECTOR,0.5,-0.06921911239624023
2019-01-29,2019-01-29T00:00:00,"Google Will Post Solid Revenues, But Expenses May Weigh On Margins, BofA Says In Q4 Preview",kaggle,,kaggle,GOOGL,SECTOR,0.5,0.7101385593414307
2019-01-29,2019-01-29T00:00:00,"UPDATE: UBS Upgrades NVIDIA As Firm Notes 'Important Q's remain unanswered, but we believe the ~20% miss to FQ4:19 (Jan '19) revenue and -15% stock move finally sets the stage for a new positive revision cycle starting this summer'",kaggle,,kaggle,NVDA,SECTOR,0.5,0.8831311464309692
2019-01-29,2019-01-29T00:00:00,"Apple Today, Powell Tomorrow: Busy Earnings And Fed Week Continues",kaggle,,kaggle,NVDA,DIRECT,1.0,-0.5849369764328003
2019-01-30,2019-01-30T00:00:00,PreMarket Prep Opening NYSE Imbalance Update: IBM 184k Shares To Sell,kaggle,,kaggle,IBM,SECTOR,0.5,-0.12508423626422882
2019-01-30,2019-01-30T00:00:00,Koch Industries' Subsidiary Invests In Metal 3D Printing,kaggle,,kaggle,GOOGL,SECTOR,0.5,0.043630510568618774
2019-01-30,2019-01-30T00:00:00,'YouTube Music comes to Sonos' -YouTube Blog,kaggle,,kaggle,GOOGL,SECTOR,0.5,0.04182164743542671
2019-01-30,2019-01-30T00:00:00,Analysts Weigh In On AMD Earnings Relief Rally,kaggle,,kaggle,NVDA,SECTOR,0.5,-0.6723942756652832
2019-01-30,2019-01-30T00:00:00,NVIDIA Option Alert: Fri $136 Calls Sweep (2) near the Ask: 500 @ $2.9 vs 1359 OI; Earnings 2/7 After Close [est] Ref=$136.9,kaggle,,kaggle,NVDA,SECTOR,0.5,-0.01428985595703125
2019-01-30,2019-01-30T00:00:00,Chip and semiconductor stocks are trading higher following Apple and AMD earnings; Apple beat Q1 estimates and AMD reported Q4 margin improvement.,kaggle,,kaggle,NVDA,DIRECT,1.0,0.9240342378616333
2019-01-31,2019-01-31T00:00:00,Cypress Semiconductor Corp shares are trading higher after the company beat Q4 earnings estimates; shares of other semiconductor stocks are trading slightly higher in sympathy.,kaggle,,kaggle,NVDA,SECTOR,0.5,0.9229775667190552
2019-01-31,2019-01-31T00:00:00,'Apple blocks Google from running its internal iOS apps' -The Verge,kaggle,,kaggle,GOOGL,DIRECT,1.0,-0.7649561166763306
2019-01-31,2019-01-31T00:00:00,Hearing Apple Taking Actions On Google Apps Following Facebook Initative,kaggle,,kaggle,GOOGL,DIRECT,1.0,-0.5247350931167603
2019-02-01,2019-02-01T00:00:00,This Day In Market History: Alphabet Briefly Becomes World's Most Valuable Company,kaggle,,kaggle,GOOGL,SECTOR,0.5,0.6573911905288696
2019-02-04,2019-02-04T00:00:00,"A Peek Into The Markets: US Stock Futures Edge Higher, Alphabet Earnings In Focus",kaggle,,kaggle,GOOGL,SECTOR,0.5,0.8747633695602417
2019-02-04,2019-02-04T00:00:00,"Apple Is The 'Better Mind' In The Tech Space, Pro Says",kaggle,,kaggle,GOOGL,DIRECT,1.0,0.3932306468486786
2019-02-04,2019-02-04T00:00:00,"Alphabet Q4 EPS $12.77 Beats $10.86 Estimate, Sales $39.276B Beat $38.98B Estimate",kaggle,,kaggle,GOOGL,SECTOR,0.5,0.41864708065986633
2019-02-04,2019-02-04T00:00:00,Alphabet Q4 Net Sales Excluding Traffic Acquisition Costs $31.84B,kaggle,,kaggle,GOOGL,SECTOR,0.5,0.006921222433447838
2019-02-04,2019-02-04T00:00:00,"From Alphabet Earnings Conference Call Q&A Section: CEO Says To Expect Cloud Unit To, In 2019, Focus On Geographies, 6 Verticals, 5 Product Areas Where It Is Seeing Returns",kaggle,,kaggle,GOOGL,SECTOR,0.5,0.6502501368522644
2019-02-04,2019-02-04T00:00:00,"Alphabet Blows Away Q4 Earnings Estimates, Shares Fall",kaggle,,kaggle,GOOGL,SECTOR,0.5,-0.9530825614929199
2019-02-04,2019-02-04T00:00:00,'Pichai says YouTube now has nearly 2B monthly logged-in users. It had 1.8B as of last May.' -Tweet From TheStreet,kaggle,,kaggle,GOOGL,SECTOR,0.5,0.040967509150505066
2019-02-04,2019-02-04T00:00:00,"'Pichai: Over the last year, the number of active users for Google Assistant has quadrupled. Assistant now supports 30 languages, up from 8 a year ago' -Tweet From TheStreet",kaggle,,kaggle,GOOGL,SECTOR,0.5,0.8742795586585999
2019-02-04,2019-02-04T00:00:00,From Alphabet Earnings Conference Call: Number Of Daily Active Users On Co.'s Shopping Doubled On Year-Over-Year Basis During Holiday Season,kaggle,,kaggle,GOOGL,SECTOR,0.5,0.8503407835960388
2019-02-04,2019-02-04T00:00:00,From Alphabet Earnings Conference Call: Board Has Authorized Added $12.5B Buyback,kaggle,,kaggle,GOOGL,SECTOR,0.5,0.6645224690437317
2019-02-04,2019-02-04T00:00:00,From Alphabet Earnings Conference Call: Sees Traffic Acquisition Costs Continuing To Increase Year Over Year As Mobile Search Grows,kaggle,,kaggle,GOOGL,SECTOR,0.5,0.6765654683113098
2019-02-04,2019-02-04T00:00:00,From Alphabet Earnings Conference Call: Forex To Remain A Headwind,kaggle,,kaggle,GOOGL,SECTOR,0.5,-0.9324944615364075
2019-02-04,2019-02-04T00:00:00,From Alphabet Earnings Conference Call: Feedback On 'Project Stream' Video Game Service Has Been 'Super Positive',kaggle,,kaggle,GOOGL,SECTOR,0.5,0.9251567721366882
2019-02-04,2019-02-04T00:00:00,From Alphabet Earnings Conference Call: Sees Capex Growth In 2019 To Moderate Quite Significantly,kaggle,,kaggle,GOOGL,SECTOR,0.5,0.4766000807285309
2019-02-05,2019-02-05T00:00:00,"'Protecting your data, no matter where you go on the web' -Google",kaggle,,kaggle,GOOGL,SECTOR,0.5,0.009524080902338028
2019-02-05,2019-02-05T00:00:00,Google Says Rolling Out Password Checkup And Cross Account Protection,kaggle,,kaggle,GOOGL,SECTOR,0.5,0.08981171250343323
2019-02-05,2019-02-05T00:00:00,"Citigroup Maintains Buy on Alphabet, Lowers Price Target to $1.325K",kaggle,,kaggle,GOOGL,SECTOR,0.5,-0.0998627096414566
2019-02-05,2019-02-05T00:00:00,"BMO Capital Maintains Market Perform on Alphabet, Lowers Price Target to $1.1K",kaggle,,kaggle,GOOGL,SECTOR,0.5,-0.1323574334383011
2019-02-05,2019-02-05T00:00:00,"Nomura Maintains Buy on Alphabet, Lowers Price Target to $1.31K",kaggle,,kaggle,GOOGL,SECTOR,0.5,0.008491456508636475
2019-02-05,2019-02-05T00:00:00,"Barclays Maintains Overweight on Alphabet, Lowers Price Target to $1.35K",kaggle,,kaggle,GOOGL,SECTOR,0.5,-0.31030482053756714
2019-02-05,2019-02-05T00:00:00,AMD Falls As Major Shareholder Sells,kaggle,,kaggle,NVDA,SECTOR,0.5,-0.3194056451320648
2019-02-05,2019-02-05T00:00:00,Wall Street Reacts To Alphabet's Q4 Earnings,kaggle,,kaggle,GOOGL,SECTOR,0.5,0.06500887870788574
2019-02-05,2019-02-05T00:00:00,'Waymo reportedly in talks with Renault-Nissan Alliance on self-driving partnership' -Electrek,kaggle,,kaggle,GOOGL,SECTOR,0.5,0.4907435476779938
2019-02-06,2019-02-06T00:00:00,Semiconductor and microchip stocks are trading higher after Microchip Technology reported strong earnings and Skyworks reported a $2 billion buyback.,kaggle,,kaggle,NVDA,SECTOR,0.5,0.9210867285728455
2019-02-06,2019-02-06T00:00:00,"'$FNJN $CSCO Markman opinion issued in the Finjan vs Cisco Systems patent infringement lawsuit. The court adopted all of Finjans proposed claim constructions, nice win for $FNJN.' -TradeHawk Tweets",kaggle,,kaggle,CSCO,SECTOR,0.5,0.025867711752653122
2019-02-07,2019-02-07T00:00:00,Shares of several semiconductors are trading lower after NXP Semiconductors provided weak Q1 sales guidance.,kaggle,,kaggle,NVDA,SECTOR,0.5,-0.964903712272644
